linkedinProfile,email,headline,location,firstName,lastName,fullName,subscribers,connectionDegree,vmid,userId,linkedinSalesNavigatorUrl,connectionsCount,connectionsUrl,mutualConnectionsUrl,company,companyUrl,jobTitle,jobLocation,jobDateRange,company2,companyUrl2,jobTitle2,jobLocation2,jobDateRange2,school,schoolUrl,schoolDegree,schoolDegreeSpec,schoolDateRange,school2,schoolUrl2,schoolDegree2,schoolDegreeSpec2,schoolDateRange2,allSkills,skill1,endorsement1,skill2,endorsement2,skill3,endorsement3,skill4,endorsement4,skill5,endorsement5,skill6,endorsement6,baseUrl,profileId,timestamp,description,imgUrl,jobDescription,jobDescription2,schoolDescription,schoolDescription2,birthday,website,twitter,facebookUrl,mail
https://www.linkedin.com/in/calvinxgomez/?miniProfileUrn=urn%3Ali%3Afs_miniProfile%3AACoAABtGsK4BFbkdDyzfJumeXKX-kwUkhn5_7wM,,Software Development Engineer at Amazon,"San Diego, California, United States",Calvin Xavier,Gomez,Calvin Xavier Gomez,684,3rd,ACoAABtGsK4BFbkdDyzfJumeXKX-kwUkhn5_7wM,457617582,"https://www.linkedin.com/sales/people/ACoAABtGsK4BFbkdDyzfJumeXKX-kwUkhn5_7wM,name",500,https://www.linkedin.com/search/results/people/?facetConnectionOf=%5B%22ACoAABtGsK4BFbkdDyzfJumeXKX-kwUkhn5_7wM%22%5D&facetNetwork=%5B%22F%22%2C%22S%22%5D&origin=MEMBER_PROFILE_CANNED_SEARCH,https://www.linkedin.com/search/results/people/?facetNetwork=%5B%22F%22%5D&facetConnectionOf=%5B%22ACoAABtGsK4BFbkdDyzfJumeXKX-kwUkhn5_7wM%22%5D&origin=MEMBER_PROFILE_CANNED_SEARCH&RESULT_TYPE=PEOPLE,Amazon,https://www.linkedin.com/company/amazon/,Software Engineer,Greater San Diego Area,Jun 2019 ï¿½ï¿½ï¿½ P,CareSolace,https://www.linkedin.com/search/results/all/?keywords=CareSolace,Lead Engineer,Greater San Diego Area,Mar 2017 ï¿½ï¿½ï¿½ Ju,"University of California, San Diego",https://www.linkedin.com/school/17954/?legacySchoolId=17954,Master of Science (M.S.),Computer Science,2015 ï¿½ï¿½ï¿,Vellore Institute of Technology,https://www.linkedin.com/school/13676/?legacySchoolId=13676,Bachelor of Technology (B.Tech.),Computer Science and Engineering,2011 ï¿½ï¿½ï¿,"Go, Node.js, Express.js, Web Applications, Web Development, Android Development, Software Development, Python, JavaScript, PHP, jQuery, MySQL, MongoDB, D3.js, Bootstrap, HTML5, CSS, C#, C, C++, Java, Cascading Style Sheets (CSS), HTML, Cassandra",Go,2,Node.js,3,Express.js,2,Web Applications,2,Web Development,2,Android Development,1,https://www.linkedin.com/in/calvinxgomez?miniProfileUrn=urn%3Ali%3Afs_miniProfile%3AACoAABtGsK4BFbkdDyzfJumeXKX-kwUkhn5_7wM,,2021-05-03T19:55:56.232Z,,https://media-exp1.licdn.com/dms/image/C5603AQFs7M9SXCdq8w/profile-displayphoto-shrink_800_800/0/1517438069213?e=1625702400&v=beta&t=gKfB0SY-y_gWKXMFCo9oHZLlKwsWYrJBNNWKtpvKDC4,,"Created the CareSolace platform. Laid the technology foundation for the company.

* Went from <1000 users to a reach of 1MM+ homes in under 2 years
* Social Impact: Helped tens of thousands of students and families suffering from mental health and substance abuse issues
* Fiscal Growth: Went from <50k to $XMM/year in revenue
  
      
          ï¿½ï¿½ï¿½
        
          se",,,,github.com/CalvinGomez,,,
https://www.linkedin.com/in/carolyn-lim-23a2a35a/?miniProfileUrn=urn%3Ali%3Afs_miniProfile%3AACoAAAyAN44BwwgxSvU6sBn3u3OZMOo-ItUWk08,,Software Development Engineer II at Amazon,"Seattle, Washington, United States",Carolyn,Lim,Carolyn Lim,694,3rd,ACoAAAyAN44BwwgxSvU6sBn3u3OZMOo-ItUWk08,209729422,"https://www.linkedin.com/sales/people/ACoAAAyAN44BwwgxSvU6sBn3u3OZMOo-ItUWk08,name",500,https://www.linkedin.com/search/results/people/?facetConnectionOf=%5B%22ACoAAAyAN44BwwgxSvU6sBn3u3OZMOo-ItUWk08%22%5D&facetNetwork=%5B%22F%22%2C%22S%22%5D&origin=MEMBER_PROFILE_CANNED_SEARCH,https://www.linkedin.com/search/results/people/?facetNetwork=%5B%22F%22%5D&facetConnectionOf=%5B%22ACoAAAyAN44BwwgxSvU6sBn3u3OZMOo-ItUWk08%22%5D&origin=MEMBER_PROFILE_CANNED_SEARCH&RESULT_TYPE=PEOPLE,Amazon,https://www.linkedin.com/company/amazon/,Software Engineer,"Seattle, WA",Feb 2019 ï¿½ï¿½ï¿½ P,Amazon,https://www.linkedin.com/company/amazon/,Software Development Engineer II,"Seattle, WA",Oct 2018 ï¿½ï¿½ï¿½ Ja,Raffles Junior College,https://www.linkedin.com/school/21012/?legacySchoolId=21012,,,2009 ï¿½ï¿½ï¿,University of Pennsylvania,https://www.linkedin.com/school/19328/?legacySchoolId=19328,Bachelor of Arts (B.A.),"Computer Science, Economics",2012 ï¿½ï¿½ï¿,"Java, Programming, Economics, Photography, Marketing, Digital Photography, Travel Photography, Blogging, Software Engineering, Analysis, Algorithms, Facebook, Python, C, Leadership, Teaching, Sports Photography",Java,26,Programming,19,Economics,18,Photography,15,Marketing,10,Digital Photography,9,https://www.linkedin.com/in/carolyn-lim-23a2a35a?miniProfileUrn=urn%3Ali%3Afs_miniProfile%3AACoAAAyAN44BwwgxSvU6sBn3u3OZMOo-ItUWk08,,2021-05-03T19:56:15.365Z,,https://media-exp1.licdn.com/dms/image/C5603AQGPSbgF8cikwA/profile-displayphoto-shrink_800_800/0/1549063236922?e=1625702400&v=beta&t=e0KpwfbJeYu_2YQOh91XrBLESmoLwh-HO13LBlIP5d8,Supply Chain Optimization Technology (SCOT) - Inventory Planning,Subscription & Discovery Box (SnDBox) - https://www.amazon.com/subscribe,"Member of the National Tennis TeamRanked 2nd in Singapore Women's Open CategoryRepresented Singapore in various international competitions including the 2008/9 Womenï¿½ï¿½ï¿½s Fed Cup, 2007/8 Junior Fed Cup, 2008/9 ASEAN Schools Games, and the 2006 World Junior Tennis Champio",,,,,,
https://www.linkedin.com/in/carrie-yang-qiao/?miniProfileUrn=urn%3Ali%3Afs_miniProfile%3AACoAABkjDOYBOihUqC_kudrrtAp8iT3r2l6eoI8#,,Software Development Engineer at Amazon Web Services (AWS),Greater Seattle Area,Yang,Qiao,Yang Qiao,779,3rd,ACoAABkjDOYBOihUqC_kudrrtAp8iT3r2l6eoI8,421727462,"https://www.linkedin.com/sales/people/ACoAABkjDOYBOihUqC_kudrrtAp8iT3r2l6eoI8,name",500,https://www.linkedin.com/search/results/people/?facetConnectionOf=%5B%22ACoAABkjDOYBOihUqC_kudrrtAp8iT3r2l6eoI8%22%5D&facetNetwork=%5B%22F%22%2C%22S%22%5D&origin=MEMBER_PROFILE_CANNED_SEARCH,https://www.linkedin.com/search/results/people/?facetNetwork=%5B%22F%22%5D&facetConnectionOf=%5B%22ACoAABkjDOYBOihUqC_kudrrtAp8iT3r2l6eoI8%22%5D&origin=MEMBER_PROFILE_CANNED_SEARCH&RESULT_TYPE=PEOPLE,Amazon Web Services (AWS),https://www.linkedin.com/company/amazon-web-services/,Software Engineer,"Seattle, Washington, United States",Oct 2020 ï¿½ï¿½ï¿½ P,Amazon,https://www.linkedin.com/company/amazon/,Software Development Engineer,"Seattle, Washington, United States",Feb 2020 ï¿½ï¿½ï¿½ P,Columbia University in the City of New York,https://www.linkedin.com/school/18943/?legacySchoolId=18943,Master of Science - MS,Data Science,2017 ï¿½ï¿½ï¿,New York University,https://www.linkedin.com/school/18993/?legacySchoolId=18993,Bachelorï¿½ï¿½ï¿½s ,"Double Major in Mathematics, Economics",,"Python, Algorithms, Data Analysis, Data Visualization, Economics, Data Structures, Machine Learning, Programming, Microsoft Excel, Microsoft Office, Java, PowerPoint, Microsoft Word, JavaScript, Django, React.js, SQL, Databases, Git, HTML, R, LaTeX, Leadership, Public Speaking, Data Analytics",Python,14,Algorithms,10,Data Analysis,11,Data Visualization,4,Economics,3,Data Structures,3,https://www.linkedin.com/in/carrie-yang-qiao?miniProfileUrn=urn%3Ali%3Afs_miniProfile%3AACoAABkjDOYBOihUqC_kudrrtAp8iT3r2l6eoI8,,2021-05-03T19:56:38.253Z,Software Engineering | Machine Learning | Deep Learning,https://media-exp1.licdn.com/dms/image/C4E03AQF6GYxtWGby6Q/profile-displayphoto-shrink_800_800/0/1567774106359?e=1625702400&v=beta&t=i9bv81LMTXQgYbyJ929vlTgpFmjJBaBS21Sktm2dEmU,,Focused on building machine learning models and forecast engine,,,,,,,
https://www.linkedin.com/in/celeste-ma-2574395b/?miniProfileUrn=urn%3Ali%3Afs_miniProfile%3AACoAAAyzUSMBsCKNsw413pQ9frYg_bj3O-1zup8#,,Software Engineer at Google,United States,Celeste,Ma,Celeste Ma,462,3rd,ACoAAAyzUSMBsCKNsw413pQ9frYg_bj3O-1zup8,213078307,"https://www.linkedin.com/sales/people/ACoAAAyzUSMBsCKNsw413pQ9frYg_bj3O-1zup8,name",467,https://www.linkedin.com/search/results/people/?facetConnectionOf=%5B%22ACoAAAyzUSMBsCKNsw413pQ9frYg_bj3O-1zup8%22%5D&facetNetwork=%5B%22F%22%2C%22S%22%5D&origin=MEMBER_PROFILE_CANNED_SEARCH,https://www.linkedin.com/search/results/people/?facetNetwork=%5B%22F%22%5D&facetConnectionOf=%5B%22ACoAAAyzUSMBsCKNsw413pQ9frYg_bj3O-1zup8%22%5D&origin=MEMBER_PROFILE_CANNED_SEARCH&RESULT_TYPE=PEOPLE,Google,https://www.linkedin.com/company/google/,Software Engineer,"Mountain View, CA",Aug 2017 ï¿½ï¿½ï¿½ P,FragranceX.com,https://www.linkedin.com/company/fragrancex-com/,Software Engineering Intern,"Hauppauge, NY",Jun 2016 ï¿½ï¿½ï¿½ Au,Stony Brook University,https://www.linkedin.com/school/19031/?legacySchoolId=19031,,,2013 ï¿½ï¿½ï¿,Universitï¿½ï¿½ Paris-Sorb,https://www.linkedin.com/school/12548/?legacySchoolId=12548,,,2014 ï¿½ï¿½ï¿,"Java, Web Applications, Database Administration, Nonprofits, Shell Scripting, HTML, JSON, C#, ASP.NET MVC, jQuery, Assembly Language, D3.js, CSS, WiX, WordPress, Oracle, UML, VB.NET, Windows XP, Windows Server, Git, Critical Thinking, Kernel Programming, MIPS",Java,9,Web Applications,7,Database Administration,4,Nonprofits,0,Shell Scripting,2,HTML,4,https://www.linkedin.com/in/celeste-ma-2574395b?miniProfileUrn=urn%3Ali%3Afs_miniProfile%3AACoAAAyzUSMBsCKNsw413pQ9frYg_bj3O-1zup8,,2021-05-03T19:57:05.601Z,"I am a motivated and dedicated professional who is able to adapt and learn quickly in new environments, while also working well in team settings to meet all goals and expectations. Currently, I am completing a degree in Computer Science from Stony Brook University, receiving significant hands-on experience in computer human interaction, and learning how to implement interfaces that are both user-friendly and functional.

I am most passionate about creating useful programs and products that allow individuals to utilize computers to increase efficiency and productivity. Upon completion of my degree, I plan to utilize my knowledge and hands-on experience from my internships to contribute to the development of programs for a technology development company.",https://media-exp1.licdn.com/dms/image/C5103AQE_48oDvOwlxA/profile-displayphoto-shrink_800_800/0/1517442867668?e=1625702400&v=beta&t=2Jo_kcbwJq1FsTr7bp3wC6VswIhiipifHoD1Ev-pXJk,,#NAME?,,,,,,,
https://www.linkedin.com/in/chaozhang404/?miniProfileUrn=urn%3Ali%3Afs_miniProfile%3AACoAAAqZSs0BIUjIABtZzPuo7q3IbplmvXWdGTE,,SDE II at Amazon,"Seattle, Washington, United States",Chao,Zhang,Chao Zhang,569,3rd,ACoAAAqZSs0BIUjIABtZzPuo7q3IbplmvXWdGTE,177818317,"https://www.linkedin.com/sales/people/ACoAAAqZSs0BIUjIABtZzPuo7q3IbplmvXWdGTE,name",500,https://www.linkedin.com/search/results/people/?facetConnectionOf=%5B%22ACoAAAqZSs0BIUjIABtZzPuo7q3IbplmvXWdGTE%22%5D&facetNetwork=%5B%22F%22%2C%22S%22%5D&origin=MEMBER_PROFILE_CANNED_SEARCH,https://www.linkedin.com/search/results/people/?facetNetwork=%5B%22F%22%5D&facetConnectionOf=%5B%22ACoAAAqZSs0BIUjIABtZzPuo7q3IbplmvXWdGTE%22%5D&origin=MEMBER_PROFILE_CANNED_SEARCH&RESULT_TYPE=PEOPLE,Amazon,https://www.linkedin.com/company/amazon/,Software Engineer,Greater Seattle Area,Nov 2018 ï¿½ï¿½ï¿½ P,Amazon,https://www.linkedin.com/company/amazon/,Software Development Engineer,"Beijing City, China",Jul 2017 ï¿½ï¿½ï¿½ No,Peking University,https://www.linkedin.com/school/11287/?legacySchoolId=11287,Doctor of Philosophy (PhD),Computer Science,2012 ï¿½ï¿½ï¿,"University of California, Santa Barbara",https://www.linkedin.com/school/17959/?legacySchoolId=17959,Visiting Scholar,Computer Engineering,2015 ï¿½ï¿½ï¿,"C++, Python, Java, Algorithms, Data Analysis, Web Services, Linux, Scala, LaTeX, gem5, Matlab, Kaldi, TensorFlow, Apache Spark, Android OS development",C++,13,Python,8,Java,3,Algorithms,4,Data Analysis,7,Web Services,0,https://www.linkedin.com/in/chaozhang404?miniProfileUrn=urn%3Ali%3Afs_miniProfile%3AACoAAAqZSs0BIUjIABtZzPuo7q3IbplmvXWdGTE,,2021-05-03T19:57:30.727Z,"Experienced Software Engineer with a demonstrated history of working in the internet industry. Skilled in Java, C++, Scala, Python, LaTeX, Data Analysis, and Linux. Strong engineering professional on both cloud services and embedded systems with a Doctor of Philosophy (PhD) focused in Computer Science from Peking University. ",https://media-exp1.licdn.com/dms/image/C5603AQH5pqhW2iFveA/profile-displayphoto-shrink_800_800/0/1517571416275?e=1625702400&v=beta&t=0TvTLwK_HsVnotWAA9c_ogqg7jZ6R7tpoAGByn1zvmE,"Now I'm with Amazon Go Training team. Looking forward to build more!

In AWS, I develop and operate a native AWS Machine Learning service; Research and develop Spark based distributed data linkage algorithm.","Member of multimedia team. Involved in research and development of ASR, used by the Alexa pipeline; Involved in device oriented performance optimization, such as ARM specific ISA, Machine Learning framework tuning etc; Involved in computer vision based innovation and prototyping.","The research interest includes energy-efficient computing and racetrack memory optimization, from architectural aspect.",,,CECA.pku.edu.cn/chaozhang,,,
https://www.linkedin.com/in/charles-m-411a67181/?miniProfileUrn=urn%3Ali%3Afs_miniProfile%3AACoAACsMn40BEk4Eq7FFGdGL2DpSm91C_bmURX8,,Senior Software Engineer,"Atherton, California, United States",Charles,M.,Charles M.,1304,3rd,ACoAACsMn40BEk4Eq7FFGdGL2DpSm91C_bmURX8,722247565,"https://www.linkedin.com/sales/people/ACoAACsMn40BEk4Eq7FFGdGL2DpSm91C_bmURX8,name",500,https://www.linkedin.com/search/results/people/?facetConnectionOf=%5B%22ACoAACsMn40BEk4Eq7FFGdGL2DpSm91C_bmURX8%22%5D&facetNetwork=%5B%22F%22%2C%22S%22%5D&origin=MEMBER_PROFILE_CANNED_SEARCH,https://www.linkedin.com/search/results/people/?facetNetwork=%5B%22F%22%5D&facetConnectionOf=%5B%22ACoAACsMn40BEk4Eq7FFGdGL2DpSm91C_bmURX8%22%5D&origin=MEMBER_PROFILE_CANNED_SEARCH&RESULT_TYPE=PEOPLE,Amazon,https://www.linkedin.com/company/amazon/,Software Engineer,"Texas, United States",Apr 2019 ï¿½ï¿½ï¿½ P,"X, the moonshot factory",https://www.linkedin.com/company/x/,Software Engineer & Roboticist,"Tokyo, Japan",Feb 2018 ï¿½ï¿½ï¿½ Ma,"University of California, Berkeley (UCB)",https://www.linkedin.com/search/results/all/?keywords=University%20of%20California%2C%20Berkeley%20(UCB),Bachelor of Technology - BTech,Computer Software Engineering,2011 ï¿½ï¿½ï¿,,,,,,"Software, Management, Software Development, Web Applications, Mobile Applications, Software Design, Software Quality Assurance, ERP Software",Software,1,Management,1,Software Development,1,Web Applications,0,Mobile Applications,0,Software Design,0,https://www.linkedin.com/in/charles-m-411a67181?miniProfileUrn=urn%3Ali%3Afs_miniProfile%3AACoAACsMn40BEk4Eq7FFGdGL2DpSm91C_bmURX8,charles-m-411a67181,2021-05-03T19:57:56.499Z,"My team at Amazon is looking to hire a software engineer. Come build the next generation of robotics software with us!
We are looking for candidates with a background in robotics, RT/embedded development or RPC communication. Most development will be in C++. Experience with ROS or DDS is desired.
Message me for details!


R&D Engineer in robotics, I am a C++ expert (among the 4% top most active coder as of June 2013 on GitHub.com[1]) and particularly interested by humanoid robotics. I have extensive experience on robot control, motion planning and vision for humanoid robots.

I have been working in different high-tech start-up (Gostai, now part of Aldebaran Robotics) and research laboratories (iLab at USC, LRDE at EPITA) around the world (France, USA, Japan). These past experiences gave me a strong background in both research and engineering.

I am dedicated to enhancing robotics community better software and as part of this effort I am a Debian contributor and maintain a couple of robotics software packages on various platforms. I am also a ROS expert (the most popular open-source robotics development platform) and contributor.

I have been given the opportunity to think of robotics software problem from the research idea up to delivering an ""industry grade"" implementation.

I also led during 5 years a non-profit organization aiming at providing support and information for non-professional video game development (a.k.a. ""Indie Games"").

Strong engineering skills in C++, Python, Linux and various open source tools.
Applied mathematics and physics.
",https://media-exp1.licdn.com/dms/image/C4E03AQFWYkeDkDjpLg/profile-displayphoto-shrink_800_800/0/1598776782029?e=1625702400&v=beta&t=TxPwyPdHr6lwUa3ZORKqQs_Hn-d5tilL_cODsZeoOsg,"Sr. SDE in the Amazon AWS Robotics and Automation team.
We develop AWS RoboMaker, a cloud robotics service that makes it easy to develop, test, and deploy intelligent robotics applications at scale: https://aws.amazon.com/robomaker/

Our team is helping making ROS 2 better! I also facilitate the ROS 2 security working group.

We're hiring!
  
      
          ï¿½ï¿½ï¿½
        
          se",,,,,,,,
https://www.linkedin.com/in/chen-yang-1bb994b6/?miniProfileUrn=urn%3Ali%3Afs_miniProfile%3AACoAABi0wR8BRlC2r7Br34pkmGsdJFqwz7BFV9w,,Software Development Engineer ï¿½ï¿½ï¿½ at ,"Seattle, Washington, United States",Chen,Yang,Chen Yang,2617,3rd,ACoAABi0wR8BRlC2r7Br34pkmGsdJFqwz7BFV9w,414499103,"https://www.linkedin.com/sales/people/ACoAABi0wR8BRlC2r7Br34pkmGsdJFqwz7BFV9w,name",500,https://www.linkedin.com/search/results/people/?facetConnectionOf=%5B%22ACoAABi0wR8BRlC2r7Br34pkmGsdJFqwz7BFV9w%22%5D&facetNetwork=%5B%22F%22%2C%22S%22%5D&origin=MEMBER_PROFILE_CANNED_SEARCH,https://www.linkedin.com/search/results/people/?facetNetwork=%5B%22F%22%5D&facetConnectionOf=%5B%22ACoAABi0wR8BRlC2r7Br34pkmGsdJFqwz7BFV9w%22%5D&origin=MEMBER_PROFILE_CANNED_SEARCH&RESULT_TYPE=PEOPLE,Amazon,https://www.linkedin.com/company/amazon/,Software Engineer,Greater Seattle Area,Nov 2020 ï¿½ï¿½ï¿½ P,Amazon,https://www.linkedin.com/company/amazon/,Software Development Engineer I,Greater Seattle Area,Feb 2019 ï¿½ï¿½ï¿½ No,University of Florida,https://www.linkedin.com/school/18120/?legacySchoolId=18120,Masterï¿½ï¿½ï¿½s ,Electrical and Computer Engineering,2014 ï¿½ï¿½ï¿,Nanjing University of Posts and Telecommunications,https://www.linkedin.com/school/11257/?legacySchoolId=11257,Bachelorï¿½ï¿½ï¿½s ,Electrical Engineering and Automation,2010 ï¿½ï¿½ï¿,"Java, Apache, Hadoop, Big Data, Testing, Programming, HDFS, Jenkins, Linux, Bash, Python, Cascading Style Sheets (CSS), HTML, JavaScript, SQL, C, Matlab, MongoDB, Eclipse, PHP, Microsoft Office, JQuery, AWS, java, javascript, Teamwork, Back-End Web Development, Customs Brokerage",Java,23,Apache,13,Hadoop,13,Big Data,3,Testing,7,Programming,0,https://www.linkedin.com/in/chen-yang-1bb994b6?miniProfileUrn=urn%3Ali%3Afs_miniProfile%3AACoAABi0wR8BRlC2r7Br34pkmGsdJFqwz7BFV9w,,2021-05-03T19:58:30.225Z,"Chen Yang is working as a software engineer 2 at Amazon. She received her Master degree from University of Florida in Electrical and Computer Engineering in 2016. She is also skilled in solving complex algorithm problems, developing websites and working in Linux environment. Chen Yang is detail-orient, patient, well-organized and has huge team work spirit.",https://media-exp1.licdn.com/dms/image/C5103AQHat_Em-uaU7w/profile-displayphoto-shrink_800_800/0/1517089693034?e=1625702400&v=beta&t=mDZ2AswzozPavB9ifJ1voPDqVfHNaj3qya-w4Y_tIwE,,,,,,,,,
https://www.linkedin.com/in/chenyi-zhang-8b1b3b135/?miniProfileUrn=urn%3Ali%3Afs_miniProfile%3AACoAACEYFkUB2T8r-kju1paaww-ilw9Sw-Bd39o,,Software Engineer,"Seattle, Washington, United States",Chenyi,Zhang,Chenyi Zhang,275,3rd,ACoAACEYFkUB2T8r-kju1paaww-ilw9Sw-Bd39o,555226693,"https://www.linkedin.com/sales/people/ACoAACEYFkUB2T8r-kju1paaww-ilw9Sw-Bd39o,name",276,https://www.linkedin.com/search/results/people/?facetConnectionOf=%5B%22ACoAACEYFkUB2T8r-kju1paaww-ilw9Sw-Bd39o%22%5D&facetNetwork=%5B%22F%22%2C%22S%22%5D&origin=MEMBER_PROFILE_CANNED_SEARCH,https://www.linkedin.com/search/results/people/?facetNetwork=%5B%22F%22%5D&facetConnectionOf=%5B%22ACoAACEYFkUB2T8r-kju1paaww-ilw9Sw-Bd39o%22%5D&origin=MEMBER_PROFILE_CANNED_SEARCH&RESULT_TYPE=PEOPLE,Microsoft,https://www.linkedin.com/company/microsoft/,Software Engineer,"County Dublin, Ireland",Dec 2018 ï¿½ï¿½ï¿½ P,Amazon,https://www.linkedin.com/company/amazon/,SDE,"Seattle, Washington, United States",Jan 2017 ï¿½ï¿½ï¿½ Ju,Stevens Institute of Technology,https://www.linkedin.com/school/18880/?legacySchoolId=18880,Master of Engineering - MEng,Computer Engineering,2014 ï¿½ï¿½ï¿,Jacksonville State University,https://www.linkedin.com/school/17729/?legacySchoolId=17729,Bachelor of Science - BS,Computer Science,2010 ï¿½ï¿½ï¿,"Microservices, NoSQL, React.js, Software Development, Docker, C#, Linux, Git, Amazon Web Services (AWS), Microsoft Azure, Java, Kubernetes, Go (Programming Language), TypeScript",Microservices,0,NoSQL,0,React.js,1,Software Development,0,Docker,0,C#,1,https://www.linkedin.com/in/chenyi-zhang-8b1b3b135?miniProfileUrn=urn%3Ali%3Afs_miniProfile%3AACoAACEYFkUB2T8r-kju1paaww-ilw9Sw-Bd39o,,2021-05-03T19:58:57.817Z,"Full-Stack Software Engineer.
Master in Web Service development with multiple language and technology stack.

",,"Core OS Dublin
Microsoft Teams with Fluid Framework
Azure Kubernetes Service",Amazon Global Store,,,,,,,
https://www.linkedin.com/in/chetan253/?miniProfileUrn=urn%3Ali%3Afs_miniProfile%3AACoAABmv2xMBIgDUFEBy2epa3wCZtUDNJzrDAQs,,Software Development Engineer,Greater Seattle Area,Chetan,Patil,Chetan Patil,773,3rd,ACoAABmv2xMBIgDUFEBy2epa3wCZtUDNJzrDAQs,430955283,"https://www.linkedin.com/sales/people/ACoAABmv2xMBIgDUFEBy2epa3wCZtUDNJzrDAQs,name",500,https://www.linkedin.com/search/results/people/?facetConnectionOf=%5B%22ACoAABmv2xMBIgDUFEBy2epa3wCZtUDNJzrDAQs%22%5D&facetNetwork=%5B%22F%22%2C%22S%22%5D&origin=MEMBER_PROFILE_CANNED_SEARCH,https://www.linkedin.com/search/results/people/?facetNetwork=%5B%22F%22%5D&facetConnectionOf=%5B%22ACoAABmv2xMBIgDUFEBy2epa3wCZtUDNJzrDAQs%22%5D&origin=MEMBER_PROFILE_CANNED_SEARCH&RESULT_TYPE=PEOPLE,Amazon,https://www.linkedin.com/company/amazon/,Software Engineer,"Seattle, WA, United States",Dec 2020 ï¿½ï¿½ï¿½ P,Amazon,https://www.linkedin.com/company/amazon/,Software Development Engineer I,Greater Seattle Area,Jul 2019 ï¿½ï¿½ï¿½ No,Indiana University Bloomington,https://www.linkedin.com/school/18342/?legacySchoolId=18342,Master's degree,Computer Science,2017 ï¿½ï¿½ï¿,University of Mumbai,https://www.linkedin.com/school/13663/?legacySchoolId=13663,Bachelor's degree,Computer Engineering,2012 ï¿½ï¿½ï¿,"Java, Python, Object-Oriented Programming (OOP), Android Development, Software Development, Web Development, Agile Methodologies, C, PostgreSQL, MongoDB, MySQL, CSS, SQL, JavaScript, Microsoft Office, HTML, JUnit, Spring Boot, Python (Programming Language), Software Design Patterns",Java,13,Python,7,Object-Oriented Programming (OOP),3,Android Development,6,Software Development,6,Web Development,2,https://www.linkedin.com/in/chetan253?miniProfileUrn=urn%3Ali%3Afs_miniProfile%3AACoAABmv2xMBIgDUFEBy2epa3wCZtUDNJzrDAQs,,2021-05-03T19:59:25.804Z,"Computer Science graduate student with experience in Full-stack software development. My experience in Software development have made me qualified with extensive skills required for a professional in the IT industry. I'm currently interning as Web Developer at Indiana University where my primary responsibilities include designing and developing new and maintaining old websites, performing technical analysis on website content and carrying out updates as required.

Competencies: Java, Spring Boot, Spring Cloud, C, Python, JavaScript, Redis, Hibernate, JUnit, Mockito, REST, HTML, CSS, PHP, NodeJS, ExpressJS, RabbitMQ, PostgreSQL, MySQL, MongoDB, Eclipse, IntelliJ, Pycharm, Android, Linux, UNIX, Windows, Git, Maven, Agile, OOP, Design Patterns",https://media-exp1.licdn.com/dms/image/C5603AQFhUidXqDEncA/profile-displayphoto-shrink_800_800/0/1559032459165?e=1625702400&v=beta&t=VXHhSvF8-zQmCcshkA8GAKn-6VVaNTGyLdjZ6xcf4MU,,,,,,,,,
