linkedinProfile,email,headline,location,firstName,lastName,fullName,subscribers,connectionDegree,vmid,userId,linkedinSalesNavigatorUrl,connectionsCount,connectionsUrl,mutualConnectionsUrl,company,companyUrl,jobTitle,jobLocation,jobDateRange,company2,companyUrl2,jobTitle2,jobLocation2,jobDateRange2,school,schoolUrl,schoolDegree,schoolDegreeSpec,schoolDateRange,school2,schoolUrl2,schoolDegree2,schoolDegreeSpec2,schoolDateRange2,allSkills,skill1,endorsement1,skill2,endorsement2,skill3,endorsement3,skill4,endorsement4,skill5,endorsement5,skill6,endorsement6,baseUrl,profileId,timestamp,description,imgUrl,jobDescription,jobDescription2,schoolDescription,schoolDescription2,birthday,website,twitter,facebookUrl,mail
https://www.linkedin.com/in/6778304421/?miniProfileUrn=urn%3Ali%3Afs_miniProfile%3AACoAACCOtboBcU6Gcqtws9sL63E9LSQOWd4Cyj8#,,Software Engineer,United States,Mian,Ibrahim,Mian Ibrahim,380,3rd,ACoAACCOtboBcU6Gcqtws9sL63E9LSQOWd4Cyj8,546223546,"https://www.linkedin.com/sales/people/ACoAACCOtboBcU6Gcqtws9sL63E9LSQOWd4Cyj8,name",381,https://www.linkedin.com/search/results/people/?facetConnectionOf=%5B%22ACoAACCOtboBcU6Gcqtws9sL63E9LSQOWd4Cyj8%22%5D&facetNetwork=%5B%22F%22%2C%22S%22%5D&origin=MEMBER_PROFILE_CANNED_SEARCH,https://www.linkedin.com/search/results/people/?facetNetwork=%5B%22F%22%5D&facetConnectionOf=%5B%22ACoAACCOtboBcU6Gcqtws9sL63E9LSQOWd4Cyj8%22%5D&origin=MEMBER_PROFILE_CANNED_SEARCH&RESULT_TYPE=PEOPLE,Microsoft,https://www.linkedin.com/company/microsoft/,Software Engineer,Greater Seattle Area,Aug 2019 ï¿½ï¿½ï¿½ P,Amazon,https://www.linkedin.com/company/amazon/,Web Developer II - Contract,Greater Seattle Area,Dec 2018 ï¿½ï¿½ï¿½ Ap,University of Massachusetts Lowell,https://www.linkedin.com/school/5071109/?legacySchoolId=5071109,Masterï¿½ï¿½ï¿½s ,Computer Engineering,2016 ï¿½ï¿½ï¿,Lahore University of Management Sciences,https://www.linkedin.com/school/15859/?legacySchoolId=15859,Bachelor's degree,Electrical Engineering,2010 ï¿½ï¿½ï¿,"Python, Linux, C, Algorithms, Software Development, Computer Vision, Data Analysis, Research, Internet Protocol Suite (TCP/IP), Java, Matlab, C++, Microsoft Office, Microsoft Excel, sql, SQL, My SQL, Git, Qlikview, javas, JavaSc, React Native, sagemaker, react, javascript, Cascading Style Sheets (CSS), Software Defined Networking, Network Function Virtualization, OpenStack, SQL Azure",Python,9,Linux,8,C,8,Algorithms,5,Software Development,5,Computer Vision,4,https://www.linkedin.com/in/6778304421?miniProfileUrn=urn%3Ali%3Afs_miniProfile%3AACoAACCOtboBcU6Gcqtws9sL63E9LSQOWd4Cyj8,,2021-05-03T19:34:07.461Z,,,,,,,,,,,
https://www.linkedin.com/in/aaditya-arigela/?miniProfileUrn=urn%3Ali%3Afs_miniProfile%3AACoAAAh9UGoBXa91h2w0Tq3S8_Tm1js_OrM08Gk,,SDE | Amazon,Greater Seattle Area,Aaditya,Arigela,Aaditya Arigela,1383,3rd,ACoAAAh9UGoBXa91h2w0Tq3S8_Tm1js_OrM08Gk,142430314,"https://www.linkedin.com/sales/people/ACoAAAh9UGoBXa91h2w0Tq3S8_Tm1js_OrM08Gk,name",500,https://www.linkedin.com/search/results/people/?facetConnectionOf=%5B%22ACoAAAh9UGoBXa91h2w0Tq3S8_Tm1js_OrM08Gk%22%5D&facetNetwork=%5B%22F%22%2C%22S%22%5D&origin=MEMBER_PROFILE_CANNED_SEARCH,https://www.linkedin.com/search/results/people/?facetNetwork=%5B%22F%22%5D&facetConnectionOf=%5B%22ACoAAAh9UGoBXa91h2w0Tq3S8_Tm1js_OrM08Gk%22%5D&origin=MEMBER_PROFILE_CANNED_SEARCH&RESULT_TYPE=PEOPLE,Amazon,https://www.linkedin.com/company/amazon/,Software Engineer,"Seattle, Washington, United States",Jul 2020 ï¿½ï¿½ï¿½ P,Amazon,https://www.linkedin.com/company/amazon/,Software Development Engineer,"Seattle, Washington",Feb 2019 ï¿½ï¿½ï¿½ Ju,Indiana University Bloomington,https://www.linkedin.com/school/18342/?legacySchoolId=18342,Master of Science (M.S.),Computer Science,2016 ï¿½ï¿½ï¿,SIES,https://www.linkedin.com/search/results/all/?keywords=SIES,Bachelor's degree,Computer Engineering,2010 ï¿½ï¿½ï¿,".NET, C#, HTML, Research, Programming, Software Development, Object-Oriented Programming (OOP), Agile Methodologies, Web Development, Design Patterns, C++, SQL, Java, C, Matlab, Microsoft Office, Microsoft SQL Server, JavaScript, CSS, Linux, jQuery, ASP.NET, Databases, .NET Framework, Cascading Style Sheets (CSS), Python, ASP.NET MVC, Visual Studio, AngularJS, Team Foundation Server (TFS), HTML5, AJAX, MySQL, JSON, Node.js, PHP, Spring Framework, Hibernate, Git, Bootstrap, TFS, Kentico, Devops, Express.js",.NET,8,C#,8,HTML,15,Research,1,Programming,6,Software Development,1,https://www.linkedin.com/in/aaditya-arigela?miniProfileUrn=urn%3Ali%3Afs_miniProfile%3AACoAAAh9UGoBXa91h2w0Tq3S8_Tm1js_OrM08Gk,,2021-05-03T19:34:33.577Z,"I am an experienced software engineer and a Graduate student, major in Computer Science. My long term career objective is to become a technical architect in the field of Software/Web Development.

--------------------------------------------------------------------------------------------------------
Specialties: JAVA / J2EE, Spring, Hibernate, Design Patterns, C#, Angular, AJAX, JavaScript, jQuery, REST/SOAP Web services, SQL (Server 2008/12/14), Data Structures and Algorithms, HTML, CSS, JSON, JUnit

Methodologies: Agile, Continuous Integration, Test Driven Development, Software Development, Software Engineering, System Architecture, Object Oriented Design, Dependency injection frameworks such as Castle Windsor and Mocking frameworks such as Moq, Operating Systems (Windows XP/7/2008R2, Linux/ UNIX, Mac OS).

Tools: Eclipse, IntelliJ, JIRA Tracking, Microsoft TFS, Microsoft Visual Studio, VS Code
-----------------------------------------------------------------------------------------------------------------",https://media-exp1.licdn.com/dms/image/C5603AQFg2vaNccVT9g/profile-displayphoto-shrink_800_800/0/1616807214535?e=1625702400&v=beta&t=d61YD7iQBdQMSaJSvX4N5NoDVIvIl2r-inK9fNfNylo,Amazon Payment Products,Amazon Payment Products,"Currently in second year of my Masters's degree, I look forward to deepen my understanding of software design and implementation from three perspectives:- Architectural- Infrastructure- Operational (DevOps) and to explore the fields of Artificial Intelligence, Cloud computing and Big Data.","My Bachelor's degree helped me explore the fundamentals of software engineering and Computer Science in general. During my bachelor's I was interested in programming principles and explored it through my coursework (Software Engineering, Advanced Database Concepts, Networks, System Security) and Web Developer internship.",.".-11,,,,
https://www.linkedin.com/in/aamgayle/?miniProfileUrn=urn%3Ali%3Afs_miniProfile%3AACoAABX_HWkBXv1mbJgAMVexaD6xK80u1vfPzhQ,,Software Engineer at Microsoft,"Atlanta, Georgia, United States",Asa,Gayle,Asa Gayle,683,3rd+,ACoAABX_HWkBXv1mbJgAMVexaD6xK80u1vfPzhQ,369040745,"https://www.linkedin.com/sales/people/ACoAABX_HWkBXv1mbJgAMVexaD6xK80u1vfPzhQ,name",500,https://www.linkedin.com/search/results/people/?facetConnectionOf=%5B%22ACoAABX_HWkBXv1mbJgAMVexaD6xK80u1vfPzhQ%22%5D&facetNetwork=%5B%22F%22%2C%22S%22%5D&origin=MEMBER_PROFILE_CANNED_SEARCH,https://www.linkedin.com/search/results/people/?facetNetwork=%5B%22F%22%5D&facetConnectionOf=%5B%22ACoAABX_HWkBXv1mbJgAMVexaD6xK80u1vfPzhQ%22%5D&origin=MEMBER_PROFILE_CANNED_SEARCH&RESULT_TYPE=PEOPLE,Microsoft,https://www.linkedin.com/company/microsoft/,Software Engineer,"Atlanta, Georgia, United States",Jun 2020 ï¿½ï¿½ï¿½ P,Florida A&M University,https://www.linkedin.com/company/florida-a&m-university/,Teaching Assistsant - CIS Department,"Tallahassee, Florida Area",Aug 2018 ï¿½ï¿½ï¿½ Ma,Florida Agricultural and Mechanical University,https://www.linkedin.com/school/18087/?legacySchoolId=18087,Master of Science - MS,Computer Science,2018 ï¿½ï¿½ï¿,Florida Agricultural and Mechanical University,https://www.linkedin.com/school/18087/?legacySchoolId=18087,Bachelor of Science - BS,Interdisciplinary Studies/Computer Science,2009 ï¿½ï¿½ï¿,"Typescript, C++, Computer Science, Web Development, Research, Computer Repair, Strategic Planning, Project Management, Python, JavaScript, HTML, CSS, React.js, Node.js, Customer Service, Teamwork, Team Leadership, Leadership, Computer Hardware Assembly",Typescript,1,C++,6,Computer Science,4,Web Development,2,Research,2,Computer Repair,4,https://www.linkedin.com/in/aamgayle?miniProfileUrn=urn%3Ali%3Afs_miniProfile%3AACoAABX_HWkBXv1mbJgAMVexaD6xK80u1vfPzhQ,,2021-05-03T19:34:57.428Z,,https://media-exp1.licdn.com/dms/image/C5603AQHS92PeVS_-Gw/profile-displayphoto-shrink_800_800/0/1619828356412?e=1625702400&v=beta&t=cfhn2jkoHNwEsb6QHb_NPq6rdmPPwElKKx5rahFtyN0,Azure Kubernetes Service Team,"Assists professor with various classes via grading student work, assisting during lab hours and holding weekly study sessions hours for the following courses:
*Fundamentals of Programming 
*Object Oriented Programming
*Data Structures and Algorithms 
*Discrete Structures
  
      
          ï¿½ï¿½ï¿½
        
          se",,,,,,,
https://www.linkedin.com/in/aasim-khan-a00ba6117/?miniProfileUrn=urn%3Ali%3Afs_miniProfile%3AACoAAB0vzCABvDonxAB_bmK1of9jQ1o0bQ3iZxA#,,Software Engineer at Microsoft,"Santa Cruz, California, United States",Aasim,Khan,Aasim Khan,1472,3rd,ACoAAB0vzCABvDonxAB_bmK1of9jQ1o0bQ3iZxA,489671712,"https://www.linkedin.com/sales/people/ACoAAB0vzCABvDonxAB_bmK1of9jQ1o0bQ3iZxA,name",500,https://www.linkedin.com/search/results/people/?facetConnectionOf=%5B%22ACoAAB0vzCABvDonxAB_bmK1of9jQ1o0bQ3iZxA%22%5D&facetNetwork=%5B%22F%22%2C%22S%22%5D&origin=MEMBER_PROFILE_CANNED_SEARCH,https://www.linkedin.com/search/results/people/?facetNetwork=%5B%22F%22%5D&facetConnectionOf=%5B%22ACoAAB0vzCABvDonxAB_bmK1of9jQ1o0bQ3iZxA%22%5D&origin=MEMBER_PROFILE_CANNED_SEARCH&RESULT_TYPE=PEOPLE,Microsoft,https://www.linkedin.com/company/microsoft/,Software Engineer,"Redmond, Washington, United States",Apr 2020 ï¿½ï¿½ï¿½ P,Microsoft,https://www.linkedin.com/company/microsoft/,Software Engineer Intern,"Redmond, Washington",Jun 2019 ï¿½ï¿½ï¿½ Se,"University of California, Santa Cruz",https://www.linkedin.com/school/17960/?legacySchoolId=17960,Master of Science - MS,Computer Science,2018 ï¿½ï¿½ï¿,Bhartiya Vidya Bhavans Sardar Patel Institute of Technology Munshi Nagar Andheri Mumbai,https://www.linkedin.com/school/216838/?legacySchoolId=216838,Bachelor of Engineering - BE,Computer Engineering,2015 ï¿½ï¿½ï¿,"C, Python, C++, Android Development, Computer Networking, Machine Learning, Data Science, Deep Learning, Software Engineering, Data Mining, Web Development, Java, JavaScript, MySQL, MongoDB, Django, Node.js, Linux, PHP, Ruby on Rails, Git, jQuery, HTML5, SQL, Cascading Style Sheets (CSS), Flask, Keras, Big Data Analytics",C,3,Python,3,C++,2,Android Development,1,Computer Networking,1,Machine Learning,3,https://www.linkedin.com/in/aasim-khan-a00ba6117?miniProfileUrn=urn%3Ali%3Afs_miniProfile%3AACoAAB0vzCABvDonxAB_bmK1of9jQ1o0bQ3iZxA,,2021-05-03T19:35:15.062Z,Software Engineer at Microsoft. Recently completed my Master's in Computer Science from UCSC with a focus on distributed systems and databases. ,https://media-exp1.licdn.com/dms/image/C5603AQH1RbLv_8tfvQ/profile-displayphoto-shrink_800_800/0/1537457632206?e=1625702400&v=beta&t=tuIGWFM9-A6suWdDwwFBbaD9yh37XBW4M1SuR-Ghtyw,R&D Data- SQL Server (Tools and Experiences),Microsoft SQL Server,,,.".-09,users.soe.ucsc.edu/~aasimkhan30/,,,
https://www.linkedin.com/in/abhijeetjain91/?miniProfileUrn=urn%3Ali%3Afs_miniProfile%3AACoAAAstC60BAGZXRgqGm9YPev9VFePLlu_c0EQ#,,Software Development Engineer at AmazonFresh,"Los Angeles, California, United States",Abhijeet,Jain,Abhijeet Jain,438,3rd,ACoAAAstC60BAGZXRgqGm9YPev9VFePLlu_c0EQ,187501485,"https://www.linkedin.com/sales/people/ACoAAAstC60BAGZXRgqGm9YPev9VFePLlu_c0EQ,name",439,https://www.linkedin.com/search/results/people/?facetConnectionOf=%5B%22ACoAAAstC60BAGZXRgqGm9YPev9VFePLlu_c0EQ%22%5D&facetNetwork=%5B%22F%22%2C%22S%22%5D&origin=MEMBER_PROFILE_CANNED_SEARCH,https://www.linkedin.com/search/results/people/?facetNetwork=%5B%22F%22%5D&facetConnectionOf=%5B%22ACoAAAstC60BAGZXRgqGm9YPev9VFePLlu_c0EQ%22%5D&origin=MEMBER_PROFILE_CANNED_SEARCH&RESULT_TYPE=PEOPLE,Amazon,https://www.linkedin.com/company/amazon/,Software Engineer,"Orange County, California Area",Jul 2017 ï¿½ï¿½ï¿½ P,Engrade - A Division of McGraw-Hill Education,https://www.linkedin.com/search/results/all/?keywords=Engrade%20-%20A%20Division%20of%20McGraw-Hill%20Education,Software Engineer Intern,"Santa Monica, Los Angeles, California",May 2016 ï¿½ï¿½ï¿½ No,University of Southern California,https://www.linkedin.com/school/17971/?legacySchoolId=17971,Masterï¿½ï¿½ï¿½s ,Computer Science,2015 ï¿½ï¿½ï¿,Rajasthan Technical University,https://www.linkedin.com/search/results/all/?keywords=Rajasthan%20Technical%20University,Bachelor of Technology (B.Tech.),Computer Engineering,2008 ï¿½ï¿½ï¿,"PHP, HTML, CSS, Cloud Computing, Android Development, JavaScript, .NET, Python, MySQL, Microsoft SQL Server, Unity, Java, C, C++, Red Hat Linux, Photoshop, OpenStack",PHP,23,HTML,18,CSS,9,Cloud Computing,10,Android Development,3,JavaScript,12,https://www.linkedin.com/in/abhijeetjain91?miniProfileUrn=urn%3Ali%3Afs_miniProfile%3AACoAAAstC60BAGZXRgqGm9YPev9VFePLlu_c0EQ,,2021-05-03T19:35:43.533Z,,https://media-exp1.licdn.com/dms/image/C5103AQEE9eDX_9-P1g/profile-displayphoto-shrink_800_800/0/1516628091130?e=1625702400&v=beta&t=rbfEMg6B9THS9ZNkeq_is_5-695GNLzCWTibemUpV3g,,,,,,,,,
https://www.linkedin.com/in/abhinav-yata-8303aa129/?miniProfileUrn=urn%3Ali%3Afs_miniProfile%3AACoAAB-PZiQB0tYmlCLMlEock0COqKZijWemcfM,,Front-End Web Developer  at Microsoft,"Seattle, Washington, United States",Abhinav,Yata,Abhinav Yata,352,3rd,ACoAAB-PZiQB0tYmlCLMlEock0COqKZijWemcfM,529491492,"https://www.linkedin.com/sales/people/ACoAAB-PZiQB0tYmlCLMlEock0COqKZijWemcfM,name",351,https://www.linkedin.com/search/results/people/?facetConnectionOf=%5B%22ACoAAB-PZiQB0tYmlCLMlEock0COqKZijWemcfM%22%5D&facetNetwork=%5B%22F%22%2C%22S%22%5D&origin=MEMBER_PROFILE_CANNED_SEARCH,https://www.linkedin.com/search/results/people/?facetNetwork=%5B%22F%22%5D&facetConnectionOf=%5B%22ACoAAB-PZiQB0tYmlCLMlEock0COqKZijWemcfM%22%5D&origin=MEMBER_PROFILE_CANNED_SEARCH&RESULT_TYPE=PEOPLE,Microsoft,https://www.linkedin.com/company/microsoft/,Software Engineer,"Seattle, Washington, United States",Jun 2020 ï¿½ï¿½ï¿½ P,Staples,https://www.linkedin.com/company/staples/,Frontend Developer,"Seattle, Washington, United States",Jan 2017 ï¿½ï¿½ï¿½ Ma,"California State University, Northridge",https://www.linkedin.com/school/17831/?legacySchoolId=17831,Master of Science - MS,Mechanical Engineering,2011 ï¿½ï¿½ï¿,JNT University,https://www.linkedin.com/search/results/all/?keywords=JNT%20University,Bachelor of Technology,Mechanical Engineering,2007 ï¿½ï¿½ï¿,"Leadership, TypeScript, JavaScript, Architecture, Front-end Development, HTML, HTML5, AngularJS, Angular Command Line Interface (CLI), Cascading Style Sheets (CSS), LESS (Stylesheet Language), Bootstrap, Python (Programming Language), Node.js, React.js, SQL, jQuery, SASS, Express.js",Leadership,0,TypeScript,0,JavaScript,0,Architecture,0,Front-end Development,0,HTML,0,https://www.linkedin.com/in/abhinav-yata-8303aa129?miniProfileUrn=urn%3Ali%3Afs_miniProfile%3AACoAAB-PZiQB0tYmlCLMlEock0COqKZijWemcfM,abhinav-yata-8303aa129,2021-05-03T19:35:55.566Z,"ýýý	Over seven years of extensive experience as a Front End UI Developer with comprehensive understanding of database designing, development and installation of different modules.
ýýý	Experienced in designing, developing, delivering and implementing Web applications for clients and the development and maintenance of company Web applications.
ýýý	Proficient in Agile Methodology - Actively participated in Sprint Planning, Daily Stand Up, Sprint Review, and Retrospective meetings.
ýýý	Comprehensive understanding of System development Life Cycle (SDLC) including its various phases, such as Analysis, Design, Development and Testing.
ýýý	Extensive experience in using JIRA for managing tasks, creating and managing user stories, and defects. 
ýýý	Experienced in developing UI applications using JavaScript TypeScript, Angular (2-8), AngularJS (1.x), HTML5, jQuery and CSS.
ýýý	Comprehensive knowledge in CSS2/CSS3, LESS, SAAS, Foundation and Bootstrap Styling Modules. 
ýýý	Working knowledge to fix cross browser compatibility issues and adhering to W3C standards.
ï¿½ï¿½ï¿½	Professional understanding of ReactJs and the Redux design patt",https://media-exp1.licdn.com/dms/image/C5603AQGiZyda7YeujA/profile-displayphoto-shrink_800_800/0/1590084135777?e=1625702400&v=beta&t=tai5_mrwLmcWk6bCdgfhPwm71iDeQpO81hRJmlJre4U,"ýýý	Project Design: Actively led the design discussions with Product Managers and Support Engineers - to understand the different type of log files and the workflows, and the UX designers, to design and implement the UI and User experience.
ýýý	Front End Implementation: 
ýýý	Created visual representation of the log files using e-charts and ag grid to highlight the errors and anomalies; merged multiple log files into a single timeline to provide the user an aggregate view.
ýýý	Created a dashboard for admin users to monitor usage of the application; users can view the usage at daily, weekly and monthly frequency.
ýýý	End to End Implementation: Created a process for the users to onboard new patterns/errors type on to the application; once onboarded, the application can automatically start detecting these new errors when processing the files.
  
      
          ýýý
        
          see more","This Merchandise planning application helps the users (Planners) to make plans based on particular product based on sales and discounts for either delivery or retail during a specific time interval was built on AngularJS and Angular 7.
ï¿½ï¿½ï¿½	Project Design: Actively participated in design discussions for the application with Project Managers and stakeholders. Also worked with the application users and UX designers to design and implement the UI and User experience.
ï¿½ï¿½ï¿½	Leadership: Led the offshore development team for the Key Item Planning project for 12 months. Primary responsibilities included delegating stories and reviewing the code.
ï¿½ï¿½ï¿½	Technical Implementation:
ï¿½ï¿½ï¿½	Improved the performance of the application render time by 50% (from 60 secs to 30 secs) by using less watchers and one-way data binding.
ï¿½ï¿½ï¿½	Implemented NGRX store to maintain single source of data, which can be shared between components and implemented effects to maintain the state of the application.
ï¿½ï¿½ï¿½	Ich can format and filter data based on userï¿½ï¿½ï¿½s preference to an excel sheet using Ignite UI.
ï¿½ï¿½ï¿½	Environment Used: Angular 7, AngularJS, HTML5, CSS, NGRX, Lodash, gulp, bower, bootstrap, Ignite-UI
  
      
          ï¿½ï¿½ï¿½
        
",,,,,,,
https://www.linkedin.com/in/abhishekbh/?miniProfileUrn=urn%3Ali%3Afs_miniProfile%3AACoAAAPP0OYBEIoUCxpXZIggrxWmXxbe5MyeytI#,,Engineering Manager,"San Francisco, California, United States",Abhishek,Bhatnagar,Abhishek Bhatnagar,763,3rd,ACoAAAPP0OYBEIoUCxpXZIggrxWmXxbe5MyeytI,63951078,"https://www.linkedin.com/sales/people/ACoAAAPP0OYBEIoUCxpXZIggrxWmXxbe5MyeytI,name",500,https://www.linkedin.com/search/results/people/?facetConnectionOf=%5B%22ACoAAAPP0OYBEIoUCxpXZIggrxWmXxbe5MyeytI%22%5D&facetNetwork=%5B%22F%22%2C%22S%22%5D&origin=MEMBER_PROFILE_CANNED_SEARCH,https://www.linkedin.com/search/results/people/?facetNetwork=%5B%22F%22%5D&facetConnectionOf=%5B%22ACoAAAPP0OYBEIoUCxpXZIggrxWmXxbe5MyeytI%22%5D&origin=MEMBER_PROFILE_CANNED_SEARCH&RESULT_TYPE=PEOPLE,Amazon,https://www.linkedin.com/company/amazon/,Software Engineer,"San Francisco, California, United States",Sep 2020 ï¿½ï¿½ï¿½ P,nurx,https://www.linkedin.com/company/nurx/,Engineering Manager,San Francisco Bay Area,Dec 2018 ï¿½ï¿½ï¿½ Ap,University of Ottawa / Universitï¿½ï¿½ d'Ot,https://www.linkedin.com/school/10858/?legacySchoolId=10858,Bachelor of Applied Science (B.A.Sc.),Electrical and Electronics Engineering,,Seneca College of Applied Arts and Technology,https://www.linkedin.com/school/19930/?legacySchoolId=19930,Bachelor's degree,Computer Software Engineering,2008 ï¿½ï¿½ï¿,"Python, PHP, Service-Oriented Architecture (SOA), Machine Learning, Agile Methodologies, Extract, Transform, Load (ETL), Data Science, Data Warehousing, Data Management, Software Development, Distributed Systems, Amazon Web Services (AWS), Docker, Laravel, Node.js, Ruby, Java, Blockchain, AngularJS, MySQL, Eclipse, Linux, C++, Django, SQLite, Open Source Software, Flask, Redux, Backbone.js, GraphQL, React.js, JavaScript, SQL, PostgreSQL, Elasticsearch, Apache Airflow, Ruby on Rails, Microservices, SQLAlchemy, Symfony, OSGi, RMI, Quadcopter, Gearman, Containerization, Apache Spark, Data Warehouse Architecture, TypeScript, Redis, Celery",Python,13,PHP,18,Service-Oriented Architecture (SOA),1,Machine Learning,0,Agile Methodologies,0,"Extract, Transform, Load (ETL)",0,https://www.linkedin.com/in/abhishekbh?miniProfileUrn=urn%3Ali%3Afs_miniProfile%3AACoAAAPP0OYBEIoUCxpXZIggrxWmXxbe5MyeytI,,2021-05-03T19:36:16.061Z,"Experienced Engineering Manager who's built and shipped products at scale (million+ users), and has grown teams and developed processes to support that growth. Looking for new roles with high scale and impact.

Key Skills:
- Engineering Leadership
- Service Oriented Architecture and Microservices
- AWS and  Cloud Architecture
- Containerization
- Building CI/CD Pipelines",https://media-exp1.licdn.com/dms/image/C5603AQGdnnlo-hYLFw/profile-displayphoto-shrink_800_800/0/1563056466319?e=1625702400&v=beta&t=15cwDnm4TxwDbyciMK8SXKNrxizKBHNeGUrrZWv8s9E,,,,,,brattahlid.wordpress.com/,abhishekToronto,,
https://www.linkedin.com/in/abidasari/?miniProfileUrn=urn%3Ali%3Afs_miniProfile%3AACoAABFjunUBybt4FrBr3DMYmR7vbilIl3c1l3U,,Software Development Engineer at Amazon,"Seattle, Washington, United States",ABHINAV,DASARI,ABHINAV DASARI,486,3rd,ACoAABFjunUBybt4FrBr3DMYmR7vbilIl3c1l3U,291748469,"https://www.linkedin.com/sales/people/ACoAABFjunUBybt4FrBr3DMYmR7vbilIl3c1l3U,name",487,https://www.linkedin.com/search/results/people/?facetConnectionOf=%5B%22ACoAABFjunUBybt4FrBr3DMYmR7vbilIl3c1l3U%22%5D&facetNetwork=%5B%22F%22%2C%22S%22%5D&origin=MEMBER_PROFILE_CANNED_SEARCH,https://www.linkedin.com/search/results/people/?facetNetwork=%5B%22F%22%5D&facetConnectionOf=%5B%22ACoAABFjunUBybt4FrBr3DMYmR7vbilIl3c1l3U%22%5D&origin=MEMBER_PROFILE_CANNED_SEARCH&RESULT_TYPE=PEOPLE,Amazon,https://www.linkedin.com/company/amazon/,Software Engineer,Greater Seattle Area,Jun 2017 ï¿½ï¿½ï¿½ P,USC Viterbi School of Engineering,https://www.linkedin.com/company/usc-viterbi-school-of-engineering/,Course Grader,Greater Los Angeles Area,Jan 2017 ï¿½ï¿½ï¿½ Ma,University of Southern California,https://www.linkedin.com/school/17971/?legacySchoolId=17971,Master of Science (M.S.),Computer Science,2015 ï¿½ï¿½ï¿,Osmania University,https://www.linkedin.com/school/13586/?legacySchoolId=13586,Bachelor of Engineering (B.E.),Computer Science,2010 ï¿½ï¿½ï¿,"C++, Java, C, Algorithms, Matlab, Python, R, CSS, Cascading Style Sheets (CSS), OpenCV, GNU Octave",C++,8,Java,8,C,8,Algorithms,5,Matlab,4,Python,4,https://www.linkedin.com/in/abidasari?miniProfileUrn=urn%3Ali%3Afs_miniProfile%3AACoAABFjunUBybt4FrBr3DMYmR7vbilIl3c1l3U,,2021-05-03T19:36:33.068Z,,https://media-exp1.licdn.com/dms/image/C4E03AQE9fUJWaM6ruQ/profile-displayphoto-shrink_800_800/0/1516846631070?e=1625702400&v=beta&t=1Uxy-ekCM5uE4R8m5Rjs7M8hfx1jkFw9SvghTajDiSM,,Worked with Prof. Ellis Horowitz and Prof. Andrew Goodney to design assignments and homework for CS 572(Information retrieval and web search engines).,,,,,,,
https://www.linkedin.com/in/abishek-sethuraman/?miniProfileUrn=urn%3Ali%3Afs_miniProfile%3AACoAAB9mSkoBuPJ_oPH2puBchmrBIZQmao80f2A,,Software Engineer at Facebook,United States,Abishek,Sethuraman,Abishek Sethuraman,426,3rd,ACoAAB9mSkoBuPJ_oPH2puBchmrBIZQmao80f2A,526797386,"https://www.linkedin.com/sales/people/ACoAAB9mSkoBuPJ_oPH2puBchmrBIZQmao80f2A,name",424,https://www.linkedin.com/search/results/people/?facetConnectionOf=%5B%22ACoAAB9mSkoBuPJ_oPH2puBchmrBIZQmao80f2A%22%5D&facetNetwork=%5B%22F%22%2C%22S%22%5D&origin=MEMBER_PROFILE_CANNED_SEARCH,https://www.linkedin.com/search/results/people/?facetNetwork=%5B%22F%22%5D&facetConnectionOf=%5B%22ACoAAB9mSkoBuPJ_oPH2puBchmrBIZQmao80f2A%22%5D&origin=MEMBER_PROFILE_CANNED_SEARCH&RESULT_TYPE=PEOPLE,Facebook,https://www.linkedin.com/company/facebook/,Software Engineer,,Aug 2020 ï¿½ï¿½ï¿½ P,Chewy,https://www.linkedin.com/company/chewy-com/,Software Engineer,"Boston, Massachusetts",Feb 2019 ï¿½ï¿½ï¿½ Au,University of Florida,https://www.linkedin.com/school/18120/?legacySchoolId=18120,Master's degree,Computer Science,2016 ï¿½ï¿½ï¿,Mumbai University Mumbai,https://www.linkedin.com/school/221697/?legacySchoolId=221697,Bachelor's degree,Electronics Engineering,2006 ï¿½ï¿½ï¿,"C#, PHP, MySQL, Web Development, Unity3D, HTML, JavaScript, Java, WordPress, AJAX, Laravel, Node.js, React.js, jQuery, Python, Docker, Docker Products, S3, AWS Lambda, SQL, Amazon Web Services (AWS), CircleCI, AWS ECS, AWS S3, Terraform, Spring Boot, Hibernate, PostgreSQL, ulink, NumPy, Scikit-Learn, Kubernetes, Amazon EC2",C#,5,PHP,6,MySQL,5,Web Development,0,Unity3D,3,HTML,3,https://www.linkedin.com/in/abishek-sethuraman?miniProfileUrn=urn%3Ali%3Afs_miniProfile%3AACoAAB9mSkoBuPJ_oPH2puBchmrBIZQmao80f2A,,2021-05-03T19:36:58.893Z,,https://media-exp1.licdn.com/dms/image/C4E03AQH6cYgqfGsiaw/profile-displayphoto-shrink_800_800/0/1535338467740?e=1625702400&v=beta&t=bw_MvUbCwdqEWjI2cE8g8b97WL4b2_9MFf4BRm9xM1g,,,,,,,,,
