linkedinProfile,email,headline,location,firstName,lastName,fullName,subscribers,connectionDegree,vmid,userId,linkedinSalesNavigatorUrl,connectionsCount,connectionsUrl,mutualConnectionsUrl,company,companyUrl,jobTitle,jobLocation,jobDateRange,company2,companyUrl2,jobTitle2,jobLocation2,jobDateRange2,school,schoolUrl,schoolDegree,schoolDegreeSpec,schoolDateRange,school2,schoolUrl2,schoolDegree2,schoolDegreeSpec2,schoolDateRange2,allSkills,skill1,endorsement1,skill2,endorsement2,skill3,endorsement3,skill4,endorsement4,skill5,endorsement5,skill6,endorsement6,baseUrl,profileId,timestamp,description,imgUrl,jobDescription,jobDescription2,schoolDescription,schoolDescription2,birthday,website,twitter,facebookUrl,mail
https://www.linkedin.com/in/alexander-knaust-218a3445/?miniProfileUrn=urn%3Ali%3Afs_miniProfile%3AACoAAAmV1zQBEusZvs43dSZLBy836DreCEa0cVw#,,Software Development Engineer at Amazon,"Austin, Texas, United States",Alexander,Knaust,Alexander Knaust,19,3rd,ACoAAAmV1zQBEusZvs43dSZLBy836DreCEa0cVw,160814900,"https://www.linkedin.com/sales/people/ACoAAAmV1zQBEusZvs43dSZLBy836DreCEa0cVw,name",19,https://www.linkedin.com/search/results/people/?facetConnectionOf=%5B%22ACoAAAmV1zQBEusZvs43dSZLBy836DreCEa0cVw%22%5D&facetNetwork=%5B%22F%22%2C%22S%22%5D&origin=MEMBER_PROFILE_CANNED_SEARCH,https://www.linkedin.com/search/results/people/?facetNetwork=%5B%22F%22%5D&facetConnectionOf=%5B%22ACoAAAmV1zQBEusZvs43dSZLBy836DreCEa0cVw%22%5D&origin=MEMBER_PROFILE_CANNED_SEARCH&RESULT_TYPE=PEOPLE,Amazon,https://www.linkedin.com/company/amazon/,Software Engineer,Greater Seattle Area,Jul 2016 ï¿½ï¿½ï¿½ P,Amazon,https://www.linkedin.com/company/amazon/,SDE Intern,,Jun 2015 ï¿½ï¿½ï¿½ Au,University of Texas at Austin,https://www.linkedin.com/search/results/all/?keywords=University%20of%20Texas%20at%20Austin,Master of Science (M.S.),Computer Science,2014 ï¿½ï¿½ï¿,The University of Texas at El Paso,https://www.linkedin.com/school/19520/?legacySchoolId=19520,Bachelor of Science (B.S.),Mathematics,2011 ï¿½ï¿½ï¿,,,,,,,,,,,,,,https://www.linkedin.com/in/alexander-knaust-218a3445?miniProfileUrn=urn%3Ali%3Afs_miniProfile%3AACoAAAmV1zQBEusZvs43dSZLBy836DreCEa0cVw,alexander-knaust-218a3445,2021-05-03T19:40:25.388Z,Come work on my team at Amazon: https://www.amazon.jobs/en/teams/device-software,https://media-exp1.licdn.com/dms/image/C5603AQGKeFvc7alJyw/profile-displayphoto-shrink_800_800/0/1521001911163?e=1625702400&v=beta&t=Qi1oXP4f0klB9gSwLMGdA9qZ9VXl8vUCQF1J6qHHlSI,Working in new Product and Device Launching.,"Added features to backend and frontend services to get business information to retailers.
ï¿½ï¿½ï¿½ Worked with Java, Ruby on Rails, and Angular JS frameworks.
ï¿½ï¿½ï¿½ Gathered requirements, designed, implemented and deployed a new feature to multiple websites.
  
      
          ï¿½ï¿½ï¿½
        
",,,,,,,
https://www.linkedin.com/in/amal-syriac/?miniProfileUrn=urn%3Ali%3Afs_miniProfile%3AACoAABY-cC8BsHCeDO1Hn_CHRQdq3hhXzT6NUlo,,Software Development Engineer at Amazon,"Atlanta, Georgia, United States",Amal,Syriac,Amal Syriac,422,3rd,ACoAABY-cC8BsHCeDO1Hn_CHRQdq3hhXzT6NUlo,373190703,"https://www.linkedin.com/sales/people/ACoAABY-cC8BsHCeDO1Hn_CHRQdq3hhXzT6NUlo,name",421,https://www.linkedin.com/search/results/people/?facetConnectionOf=%5B%22ACoAABY-cC8BsHCeDO1Hn_CHRQdq3hhXzT6NUlo%22%5D&facetNetwork=%5B%22F%22%2C%22S%22%5D&origin=MEMBER_PROFILE_CANNED_SEARCH,https://www.linkedin.com/search/results/people/?facetNetwork=%5B%22F%22%5D&facetConnectionOf=%5B%22ACoAABY-cC8BsHCeDO1Hn_CHRQdq3hhXzT6NUlo%22%5D&origin=MEMBER_PROFILE_CANNED_SEARCH&RESULT_TYPE=PEOPLE,Amazon,https://www.linkedin.com/company/amazon/,Software Engineer,,Feb 2021 ï¿½ï¿½ï¿½ P,Georgia Institute of Technology,https://www.linkedin.com/company/georgia-institute-of-technology/,Graduate Teaching Assistant,"Atlanta, Georgia, United States",Aug 2020 ï¿½ï¿½ï¿½ De,Georgia Institute of Technology,https://www.linkedin.com/school/18158/?legacySchoolId=18158,Master of Science - MS,Computer Science,2019 ï¿½ï¿½ï¿,National Institute of Technology Tiruchirappalli,https://www.linkedin.com/school/20403/?legacySchoolId=20403,Bachelor of Technology (B.Tech.),Computer Science and Engineering,2012 ï¿½ï¿½ï¿,"C++, HTML, C, Web Development, Distributed Systems, Computer Science, Algorithms, Linux, PHP, Java, JavaScript, Python (Programming Language)",C++,4,HTML,3,C,3,Web Development,2,Distributed Systems,1,Computer Science,1,https://www.linkedin.com/in/amal-syriac?miniProfileUrn=urn%3Ali%3Afs_miniProfile%3AACoAABY-cC8BsHCeDO1Hn_CHRQdq3hhXzT6NUlo,,2021-05-03T19:40:47.271Z,,https://media-exp1.licdn.com/dms/image/C5603AQEs-2Ro4XL6YQ/profile-displayphoto-shrink_800_800/0/1578895019196?e=1625702400&v=beta&t=ahyZlk_hUZO_6_ipoHKF5_tLth-FwfkpaTLY5A-_nJE,,CS 6210 Advanced Operating Systems,,,,,,,
https://www.linkedin.com/in/amber-lee-991a5a9a/?miniProfileUrn=urn%3Ali%3Afs_miniProfile%3AACoAABUoNf0BXvP3pyY5nBwGOVsPDQ9ZY5tMtBQ#,,Software Development Engineer at Amazon,United States,Amber,Lee,Amber Lee,273,3rd,ACoAABUoNf0BXvP3pyY5nBwGOVsPDQ9ZY5tMtBQ,354956797,"https://www.linkedin.com/sales/people/ACoAABUoNf0BXvP3pyY5nBwGOVsPDQ9ZY5tMtBQ,name",269,https://www.linkedin.com/search/results/people/?facetConnectionOf=%5B%22ACoAABUoNf0BXvP3pyY5nBwGOVsPDQ9ZY5tMtBQ%22%5D&facetNetwork=%5B%22F%22%2C%22S%22%5D&origin=MEMBER_PROFILE_CANNED_SEARCH,https://www.linkedin.com/search/results/people/?facetNetwork=%5B%22F%22%5D&facetConnectionOf=%5B%22ACoAABUoNf0BXvP3pyY5nBwGOVsPDQ9ZY5tMtBQ%22%5D&origin=MEMBER_PROFILE_CANNED_SEARCH&RESULT_TYPE=PEOPLE,Amazon,https://www.linkedin.com/company/amazon/,Software Engineer,Greater Seattle Area,Jul 2017 ï¿½ï¿½ï¿½ P,Amazon Web Services,https://www.linkedin.com/company/amazon-web-services/,Software Development Engineer Intern,Greater Seattle Area,Aug 2016 ï¿½ï¿½ï¿½ De,University of Waterloo,https://www.linkedin.com/school/10875/?legacySchoolId=10875,Bachelor of Computer Science,,2017,Leamington District Secondary School,https://www.linkedin.com/search/results/all/?keywords=Leamington%20District%20Secondary%20School,,,,"Java, C++, JavaScript, Web Design, Object Oriented Design, AngularJS, Amazon Web Services (AWS), HTML, CSS, Node.js, SQL, Git, Spring Framework, C, MongoDB, Bootstrap, Python, Illustrator, Microsoft Excel, Databases, Pandas (Software), AWS Lambda, AWS CloudFormation, Amazon S3, React.js, Customer Service, Highly detail oriented, TypeScript, Amazon Dynamodb",Java,3,C++,6,JavaScript,7,Web Design,6,Object Oriented Design,3,AngularJS,2,https://www.linkedin.com/in/amber-lee-991a5a9a?miniProfileUrn=urn%3Ali%3Afs_miniProfile%3AACoAABUoNf0BXvP3pyY5nBwGOVsPDQ9ZY5tMtBQ,amber-lee-991a5a9a,2021-05-03T19:41:03.436Z,"ýýý Proficient in C++,  C, Java, Node.js, AngularJS, HTML & CSS, SQL, GraphQL
ýýý Experience with building Android applications
ýýý experience using AWS services including S3, SQS & SNS, AWS Lambda, Redshift, DynamoDB, AWS SDK for Java, etc
ýýý Git, UNIX, Adobe Illustrator, InDesign, Photoshop
ýýý Strong project management, design & UI/UX skills",https://media-exp1.licdn.com/dms/image/C5603AQFTAXXzBXXuew/profile-displayphoto-shrink_800_800/0/1619114703121?e=1625702400&v=beta&t=w4IloV1HJ574zXTDDsuJHtsq6yW8gX5t-JwHTxfzZpQ,"Tech Stack: Java, Python, Typescript, GraphQL, ReactJS, AWS - S3, DynamoDB, Lambda, Redshift, SNS/SQS, ECS, IAM, API Gateway, CloudFormation, etc.

Teams: Middle Mile Demand Forecasting, AWS IQ","Elastic Block Store (EBS) team
ï¿½ï¿½ï¿½ Designed and developed new Java services using Amazon web services including S3, SQS and Redshift that allows various client EBS datasets to be automatically centralized in a global Redshift cluster
ï¿½ï¿½ï¿½ Worked with AWS SDK for Java and Spring Framework
ï¿½ï¿½ï¿½ Service monitored data-quality and failure metrics to help improve EBS experience for EC2 customers
Tech stack: AWS SDK, S3, SQS, Redshift, Java, SQL, Spring Framework
  
      
          ï¿½ï¿½ï¿½
   ",,,,https://www.amberzlee.com,,,
https://www.linkedin.com/in/ameyaadvankar/?miniProfileUrn=urn%3Ali%3Afs_miniProfile%3AACoAAAveCEwB29cswqP6zqwufmtbUgnqaEjjZnU,,Software Engineer,"San Jose, California, United States",Ameya,Advankar,Ameya Advankar,371,3rd,ACoAAAveCEwB29cswqP6zqwufmtbUgnqaEjjZnU,199100492,"https://www.linkedin.com/sales/people/ACoAAAveCEwB29cswqP6zqwufmtbUgnqaEjjZnU,name",372,https://www.linkedin.com/search/results/people/?facetConnectionOf=%5B%22ACoAAAveCEwB29cswqP6zqwufmtbUgnqaEjjZnU%22%5D&facetNetwork=%5B%22F%22%2C%22S%22%5D&origin=MEMBER_PROFILE_CANNED_SEARCH,https://www.linkedin.com/search/results/people/?facetNetwork=%5B%22F%22%5D&facetConnectionOf=%5B%22ACoAAAveCEwB29cswqP6zqwufmtbUgnqaEjjZnU%22%5D&origin=MEMBER_PROFILE_CANNED_SEARCH&RESULT_TYPE=PEOPLE,Google,https://www.linkedin.com/company/google/,Software Engineer,,Dec 2020 ï¿½ï¿½ï¿½ P,Cisco,https://www.linkedin.com/company/cisco/,Software Engineer,San Francisco Bay Area,Aug 2018 ï¿½ï¿½ï¿½ De,Indiana University Bloomington,https://www.linkedin.com/school/18342/?legacySchoolId=18342,Master's degree,Computer Science,2016 ï¿½ï¿½ï¿,University of Mumbai,https://www.linkedin.com/school/13663/?legacySchoolId=13663,Bachelor of Engineering (BE),Computer Engineering,2009 ï¿½ï¿½ï¿,"Java, React.js, Docker, Software Development, Shell Script, Shell Scripting, Web Applications, Web Development, Software Development Life Cycle (SDLC), Amazon Web Services (AWS), JavaScript, MySQL, Core Java, jQuery, SQL, Databases, JSP, Unix, Servlets, Git, Bash, Spring MVC, JIRA, XML, Linux, Jenkins, Amazon EC2, Flex, Sybase Adaptive Server, Apache ZooKeeper",Java,14,React.js,0,Docker,0,Software Development,0,Shell Script,1,Shell Scripting,0,https://www.linkedin.com/in/ameyaadvankar?miniProfileUrn=urn%3Ali%3Afs_miniProfile%3AACoAAAveCEwB29cswqP6zqwufmtbUgnqaEjjZnU,,2021-05-03T19:41:29.268Z,,https://media-exp1.licdn.com/dms/image/C5103AQHhccKT_inl3A/profile-displayphoto-shrink_800_800/0/1516936777481?e=1625702400&v=beta&t=WgQBVljwxdkbPactM9nlKFi8maP-GhBeoIU7YL3Y9Lg,,"- Worked on developing a micro-service based App providing Network Insights within the Data Center Business Unit at Cisco. App improved Customerï¿½ï¿½ï¿½s Day2Ops experience with as much as 95% efficiency in proactive cases and 33% efficiency in reactive cases.
- Developed the GUI from ground up in ReactJS for v1.0 of the App.
- Designed and developed multiple end-to-end application features [ReactJS, Java, Go, Python] for 5 releases of the App to provide rich feature set.
  
      
          ï¿½ï¿½ï¿½
        
      ",,,,ameya05.github.io,,,
https://www.linkedin.com/in/amitshah261/?miniProfileUrn=urn%3Ali%3Afs_miniProfile%3AACoAABE-ungB4TTliCsjx1VMXtlCCpFwVPU5ah8#,,Software Development Enthusiast |  Always looking for challenging problems to solve,Greater Seattle Area,Amit,Shah,Amit Shah,667,3rd,ACoAABE-ungB4TTliCsjx1VMXtlCCpFwVPU5ah8,289323640,"https://www.linkedin.com/sales/people/ACoAABE-ungB4TTliCsjx1VMXtlCCpFwVPU5ah8,name",500,https://www.linkedin.com/search/results/people/?facetConnectionOf=%5B%22ACoAABE-ungB4TTliCsjx1VMXtlCCpFwVPU5ah8%22%5D&facetNetwork=%5B%22F%22%2C%22S%22%5D&origin=MEMBER_PROFILE_CANNED_SEARCH,https://www.linkedin.com/search/results/people/?facetNetwork=%5B%22F%22%5D&facetConnectionOf=%5B%22ACoAABE-ungB4TTliCsjx1VMXtlCCpFwVPU5ah8%22%5D&origin=MEMBER_PROFILE_CANNED_SEARCH&RESULT_TYPE=PEOPLE,Microsoft,https://www.linkedin.com/company/microsoft/,Software Engineer,Greater Seattle Area,Mar 2020 ï¿½ï¿½ï¿½ P,Microsoft,https://www.linkedin.com/company/microsoft/,Software Engineer,Greater Seattle Area,Nov 2018 ï¿½ï¿½ï¿½ Ma,Rochester Institute of Technology,https://www.linkedin.com/school/19008/?legacySchoolId=19008,Masterï¿½ï¿½ï¿½s ,Computer Science,2015 ï¿½ï¿½ï¿,University of Mumbai,https://www.linkedin.com/school/13663/?legacySchoolId=13663,Bachelorï¿½ï¿½ï¿½s ,Information Technology,2011 ï¿½ï¿½ï¿,"SQL, Java, Programming, Web Development, Software Development, Software, Agile Methodologies, Cloud Computing, Machine Learning, HTML, C++, Microsoft Office, JavaScript, MySQL, C, PHP, Microsoft SQL Server, Tableau, Visual Basic, R, Cascading Style Sheets (CSS), C Programming, Microsoft Excel, PowerPoint, Python, Windows, Microsoft Word, Microsoft PowerPoint, C#, Amazon Web Services (AWS), Core Java, XML, Node.js, Eclipse, Linux, Leadership, Group Work",SQL,25,Java,24,Programming,20,Web Development,4,Software Development,0,Software,0,https://www.linkedin.com/in/amitshah261?miniProfileUrn=urn%3Ali%3Afs_miniProfile%3AACoAABE-ungB4TTliCsjx1VMXtlCCpFwVPU5ah8,,2021-05-03T19:41:56.651Z,"Innovative and diligent Computer Science enthusiast always looking to solve challenging problems and every opportunity to learn, grow and help others achieve their purpose.",https://media-exp1.licdn.com/dms/image/C5603AQGUXVO89FpQAA/profile-displayphoto-shrink_800_800/0/1542079127668?e=1625702400&v=beta&t=zzFL-Uv52g6M_0zKrY1DjXxb7Hj4KryhHEygO_M6WB4,,,Masters in Computer Science,,Januany 26,,amitshah261,,
https://www.linkedin.com/in/amruthagujjar/?miniProfileUrn=urn%3Ali%3Afs_miniProfile%3AACoAABZZJJoBOB9j8ZhMSXloy6uYfrKZlGK-8rQ,,Software Engineer @ Facebook,Greater Seattle Area,Amrutha,Gujjar,Amrutha Gujjar,2770,3rd,ACoAABZZJJoBOB9j8ZhMSXloy6uYfrKZlGK-8rQ,374940826,"https://www.linkedin.com/sales/people/ACoAABZZJJoBOB9j8ZhMSXloy6uYfrKZlGK-8rQ,name",500,https://www.linkedin.com/search/results/people/?facetConnectionOf=%5B%22ACoAABZZJJoBOB9j8ZhMSXloy6uYfrKZlGK-8rQ%22%5D&facetNetwork=%5B%22F%22%2C%22S%22%5D&origin=MEMBER_PROFILE_CANNED_SEARCH,https://www.linkedin.com/search/results/people/?facetNetwork=%5B%22F%22%5D&facetConnectionOf=%5B%22ACoAABZZJJoBOB9j8ZhMSXloy6uYfrKZlGK-8rQ%22%5D&origin=MEMBER_PROFILE_CANNED_SEARCH&RESULT_TYPE=PEOPLE,Facebook,https://www.linkedin.com/company/facebook/,Software Engineer,,Feb 2020 ï¿½ï¿½ï¿½ P,Facebook,https://www.linkedin.com/company/facebook/,Software Engineer I,"Seattle, Washington",Apr 2019 ï¿½ï¿½ï¿½ P,University of Illinois at Urbana-Champaign,https://www.linkedin.com/school/18321/?legacySchoolId=18321,Masters,Computer Science,2020 ï¿½ï¿½ï¿,University of Washington,https://www.linkedin.com/school/19657/?legacySchoolId=19657,Bachelor of Science,Computer Science,2015 ï¿½ï¿½ï¿,"Software Development, Leadership, Computer Science, Machine Learning, Distributed Systems, Algorithms, Database Design, Software Design, Programming, Java, C#, SQL, JavaScript, Python, C++, Linux, C (Programming Language), Operating Systems, Public Speaking, Teamwork",Software Development,26,Leadership,22,Computer Science,5,Machine Learning,1,Distributed Systems,1,Algorithms,1,https://www.linkedin.com/in/amruthagujjar?miniProfileUrn=urn%3Ali%3Afs_miniProfile%3AACoAABZZJJoBOB9j8ZhMSXloy6uYfrKZlGK-8rQ,,2021-05-03T19:42:21.538Z,"Software Engineer at Facebook - Integrity Machine Learning 

Bachelor of Science in Computer Science from University of Washington's Allen School of CSE. Currently pursuing Masters in Computer Science from University of Illinois - Urbana Champaign, with a focus on machine learning subjects.",https://media-exp1.licdn.com/dms/image/C5603AQEXYrM7dE8z4w/profile-displayphoto-shrink_800_800/0/1554198972773?e=1625702400&v=beta&t=7JpjZvfVhu1hz4Ta06OadGbOsGLsvEOhSVpdgAvsHAI,"Content Integrity: Dangerous Content Machine Learning

Facebook Content Integrity, is at the forefront of tackling some of the most important and profoundly human questions of our time, at an unprecedented scale... How do we manage the spread of misinformation? How do we combat global terrorism online? How do we define and prevent hateful and violence-inciting speech while still protecting free speech? Facebook is spearheading innovation in the realm of machine learning to build a platform that is safe for billions of people around the world.",,"Machine Learning Track: Applied Machine Learning, Practical Statistical Learning, Introduction to Data Mining, Numerical Analysis, Advanced Bayesian Modeling, Foundations of Data Curation, Methods of Applied Statistics, Data Visualization, Text Information Systems","Paul G. Allen School of Computer ScienceAlgorithms, Machine Learning, Distributed Systems, Data Abstractions, Software Design and Implementation, Robotics",,,,,
https://www.linkedin.com/in/anchalkpr/?miniProfileUrn=urn%3Ali%3Afs_miniProfile%3AACoAAAuSE3sBgE3ErAXWywZ-SRPcvih3WFJ9Xxc,,Software Engineer 2 at Microsoft,San Francisco Bay Area,Anchal,Kapoor,Anchal Kapoor,1052,3rd,ACoAAAuSE3sBgE3ErAXWywZ-SRPcvih3WFJ9Xxc,194122619,"https://www.linkedin.com/sales/people/ACoAAAuSE3sBgE3ErAXWywZ-SRPcvih3WFJ9Xxc,name",500,https://www.linkedin.com/search/results/people/?facetConnectionOf=%5B%22ACoAAAuSE3sBgE3ErAXWywZ-SRPcvih3WFJ9Xxc%22%5D&facetNetwork=%5B%22F%22%2C%22S%22%5D&origin=MEMBER_PROFILE_CANNED_SEARCH,https://www.linkedin.com/search/results/people/?facetNetwork=%5B%22F%22%5D&facetConnectionOf=%5B%22ACoAAAuSE3sBgE3ErAXWywZ-SRPcvih3WFJ9Xxc%22%5D&origin=MEMBER_PROFILE_CANNED_SEARCH&RESULT_TYPE=PEOPLE,Microsoft,https://www.linkedin.com/company/microsoft/,Software Engineer,,Mar 2021 ï¿½ï¿½ï¿½ P,Microsoft,https://www.linkedin.com/company/microsoft/,Software Engineer,Sunnyvale,Sep 2018 ï¿½ï¿½ï¿½ Fe,University of Southern California,https://www.linkedin.com/school/17971/?legacySchoolId=17971,Master of Science (M.S.),Computer Science,2016 ï¿½ï¿½ï¿,Panjab University,https://www.linkedin.com/school/13589/?legacySchoolId=13589,Bachelor of Engineering (BE) (Hons),Computer Science,2009 ï¿½ï¿½ï¿,"Python, Java, MySQL, Algorithms, Machine Learning, Software Development, Data Modeling, Statistics, Database Administration, Data Analysis, Cloud Computing, Linux, PostgreSQL, Eclipse, C++, C, Matlab, R, HTML, CSS, MongoDB, Pandas, Hadoop, SQL, Databases, Git, NoSQL, Microsoft SQL Server, Microsoft Azure, NLTK, NumPy, Scikit-Learn, OpenCV, Database Development, Redis, Riak, Cassandra, CouchDB",Python,7,Java,20,MySQL,6,Algorithms,1,Machine Learning,2,Software Development,0,https://www.linkedin.com/in/anchalkpr?miniProfileUrn=urn%3Ali%3Afs_miniProfile%3AACoAAAuSE3sBgE3ErAXWywZ-SRPcvih3WFJ9Xxc,,2021-05-03T19:42:50.027Z,"I recently graduated from University of Southern California.

My major focus areas are data engineering, machine learning and software engineering in general. I love solving real-life problems using software engineering and curiosity keeps me going.

Technical skills:
Languages & Libraries:    Python, Java, HTML, Shell, R, Spark, NumPy, Pandas, NLTK, Scikit, Hadoop, Node
DB & OS:                           MySQL, MongoDB, PostgreSQL, Windows, Linux, OSX
Others:                              SVN, JIRA, Git, JUnit, TestNG, Maven, GCP
ML Algorithms:                 KNN, K-means clustering, Linear Regression, Logistic Regression, SVM, PCA, 
                                           Neural Networks, Gausian Mixture Models, Hidden Markov Models, EM, Naive Bayes, LDA",https://media-exp1.licdn.com/dms/image/C5603AQH1bNsS_DrKMQ/profile-displayphoto-shrink_800_800/0/1617815935218?e=1625702400&v=beta&t=LJAzy3r1OevvOYiakkkfEgYnwqHHTqLmxRk6Cr1L4_Q,,,,,*..-18,https://github.com/anchalkpr/,,,
https://www.linkedin.com/in/andresma/?miniProfileUrn=urn%3Ali%3Afs_miniProfile%3AACoAAAMVTPgBsiZ3pw9dNuGAysqXqEkXh4YfeEw,,Software Engineer,Greater Seattle Area,Andres,Martinez,Andres Martinez,530,3rd,ACoAAAMVTPgBsiZ3pw9dNuGAysqXqEkXh4YfeEw,51727608,"https://www.linkedin.com/sales/people/ACoAAAMVTPgBsiZ3pw9dNuGAysqXqEkXh4YfeEw,name",500,https://www.linkedin.com/search/results/people/?facetConnectionOf=%5B%22ACoAAAMVTPgBsiZ3pw9dNuGAysqXqEkXh4YfeEw%22%5D&facetNetwork=%5B%22F%22%2C%22S%22%5D&origin=MEMBER_PROFILE_CANNED_SEARCH,https://www.linkedin.com/search/results/people/?facetNetwork=%5B%22F%22%5D&facetConnectionOf=%5B%22ACoAAAMVTPgBsiZ3pw9dNuGAysqXqEkXh4YfeEw%22%5D&origin=MEMBER_PROFILE_CANNED_SEARCH&RESULT_TYPE=PEOPLE,Microsoft,https://www.linkedin.com/company/microsoft/,Software Engineer,"Redmond, Washington",Aug 2018 ï¿½ï¿½ï¿½ P,Capital One,https://www.linkedin.com/company/capital-one/,"Manager, Software Engineering","Seattle, Washington",Jul 2017 ï¿½ï¿½ï¿½ Au,Tecnolï¿½ï¿½gico de Monte,https://www.linkedin.com/school/15036/?legacySchoolId=15036,Bachelor,Computer Science,2004 ï¿½ï¿½ï¿,,,,,,"C#, Software Development, Microsoft SQL Server, Web Development, Software Engineering, Programming, Cloud Computing, Integration, Software Design, Project Management, Agile Methodologies, Scrum, Software Development Life Cycle (SDLC), Service-Oriented Architecture (SOA), Web Services, Distributed Systems, Software Project Management, Program Management, Strategy, Strategic Planning, C++, SQL, Databases, Windows Azure, Microsoft Azure, .NET Framework, JavaScript, XML, Java, Representational State Transfer (REST), Enterprise Software, Management, Scalable Architecture, Performance Analysis, Cloud Services",C#,15,Software Development,12,Microsoft SQL Server,9,Web Development,6,Software Engineering,6,Programming,6,https://www.linkedin.com/in/andresma?miniProfileUrn=urn%3Ali%3Afs_miniProfile%3AACoAAAMVTPgBsiZ3pw9dNuGAysqXqEkXh4YfeEw,,2021-05-03T19:43:10.999Z,"Technical leader and software engineer, experienced in management and individual contributor positions.

Areas of expertise:
- Micro-services, lambdas, functions  
- Cloud services design and architecture
- Design of software frameworks
- Event driven applications

Management & leadership:
+ Technical direction
+ Business strategy
+ User experience
+ Engineering excellence 
+ Developer productivity",,Driving performance initiatives for cloud services and building frameworks to develop business applications with event-driven architectures.,"Lead a group of senior engineers. Responsible for technical direction, hiring, and career development.",,,,,andrmtza,,
https://www.linkedin.com/in/andrewdkim47/?miniProfileUrn=urn%3Ali%3Afs_miniProfile%3AACoAACbfxAoBp2HfMdAnEIpuyumEP3FeYXWrjF8#,,Incoming Software Engineer at Amazon | Web Developer at CAEN,"Ann Arbor, Michigan, United States",Andrew,Kim,Andrew Kim,1005,3rd,ACoAACbfxAoBp2HfMdAnEIpuyumEP3FeYXWrjF8,652198922,"https://www.linkedin.com/sales/people/ACoAACbfxAoBp2HfMdAnEIpuyumEP3FeYXWrjF8,name",500,https://www.linkedin.com/search/results/people/?facetConnectionOf=%5B%22ACoAACbfxAoBp2HfMdAnEIpuyumEP3FeYXWrjF8%22%5D&facetNetwork=%5B%22F%22%2C%22S%22%5D&origin=MEMBER_PROFILE_CANNED_SEARCH,https://www.linkedin.com/search/results/people/?facetNetwork=%5B%22F%22%5D&facetConnectionOf=%5B%22ACoAACbfxAoBp2HfMdAnEIpuyumEP3FeYXWrjF8%22%5D&origin=MEMBER_PROFILE_CANNED_SEARCH&RESULT_TYPE=PEOPLE,Amazon,https://www.linkedin.com/company/amazon/,Software Engineer,New York City Metropolitan Area,Feb 2021 ï¿½ï¿½ï¿½ P,University of Michigan,https://www.linkedin.com/company/university-of-michigan/,Web Developer at CAEN,"Ann Arbor, Michigan, United States",Mar 2020 ï¿½ï¿½ï¿½ P,"University of Michigan College of Literature, Science, and the Arts",https://www.linkedin.com/school/43291/?legacySchoolId=43291,Bachelor of Science - BS,Computer Science,2017 ï¿½ï¿½ï¿,Yonsei University,https://www.linkedin.com/school/14724/?legacySchoolId=14724,Yonsei Summer Program,,2018 ï¿½ï¿½ï¿,"C++, Python, Adobe Illustrator, Web Development, Algorithms, Data Structures, Music Production, Test Automation, Data Analysis, Agile Methodologies, Microsoft Office, HTML, C, CSS, Microsoft PowerPoint, Microsoft Word, Microsoft Excel, R, Java, JavaScript, C#, Git, GitHub, Amazon Web Services (AWS), React.js, Node.js, PostgreSQL, Docker, REST API, Redux.js, Jira, Public Speaking, Leadership, Time Management, Teamwork, Customer Service, Korean, Electric Guitar, Sourcetree, Socket.io, Express.js, Sprint Planning",C++,8,Python,3,Adobe Illustrator,3,Web Development,1,Algorithms,0,Data Structures,0,https://www.linkedin.com/in/andrewdkim47?miniProfileUrn=urn%3Ali%3Afs_miniProfile%3AACoAACbfxAoBp2HfMdAnEIpuyumEP3FeYXWrjF8,,2021-05-03T19:43:31.796Z,"As a senior at UofM pursuing a Computer Science degree, I am looking for exciting opportunities to grow professionally as a software developer.

I have a deep understanding of software development and software testing, and I am currently taking challenging technical courses to obtain the valuable skills that will shape my career. My area of focus is web development and computer vision, and I hope to gain more insight into machine learning and AI.

Please feel free to contact me anytime!",https://media-exp1.licdn.com/dms/image/C4E03AQGEsA4E_uY16g/profile-displayphoto-shrink_800_800/0/1555973189387?e=1625702400&v=beta&t=allwizKBdM8oeTW9wP3bzZtt-jjamU8uy9nWWw2N-xY,,Develop new web applications for CAEN services at the University of Michigan. Utilize React.js to create streamlined and scaled programs used by the College of Engineering staff.,Pursuing a computer science career with a minor in musicCOURSES:EECS 183: Elementary Programming ConceptsEECS 280: Programming and Data StructureEECS 203: Discrete MathematicsEECS 281: Data Structures and AlgorithmsEECS 370: Computer OrganizationEECS 376: Foundations of Computer ScienceEECS 485: Web SystemsEECS 482: Operating SystemsEECS 442: Computer VisionEECS 493: User Interface DevEECS 497: Human-Centered Software DevelopmentSI 206: Data-Oriented ProgrammingSTATS 250: Intro to Statistics and Data Analysis---------------------------------------------------------MUSICOL 121: Art of MusicPAT 200: Intro Elec Music ProductionPAT 305: Video Game MusicCOMP 415: Intro in Electronic MusicCOMP 416: Seminar in Electronic MusicMUSICOL 408: Contemporary Popular Music,"Experienced Korea as an independent student. Took courses such as Korean Cinema, Social Psychology, along with classes such as Statistics that helped me grow in my field.",,andrewdkim47.github.io/,,,
