linkedinProfile,email,headline,location,firstName,lastName,fullName,subscribers,connectionDegree,vmid,userId,linkedinSalesNavigatorUrl,connectionsCount,connectionsUrl,mutualConnectionsUrl,company,companyUrl,jobTitle,jobLocation,jobDateRange,company2,companyUrl2,jobTitle2,jobLocation2,jobDateRange2,school,schoolUrl,schoolDegree,schoolDegreeSpec,schoolDateRange,school2,schoolUrl2,schoolDegree2,schoolDegreeSpec2,schoolDateRange2,allSkills,skill1,endorsement1,skill2,endorsement2,skill3,endorsement3,skill4,endorsement4,skill5,endorsement5,skill6,endorsement6,baseUrl,profileId,timestamp,description,imgUrl,jobDescription,jobDescription2,schoolDescription,schoolDescription2,birthday,website,twitter,facebookUrl,mail
https://www.linkedin.com/in/anshuman-d-vyas-bb84733a/?miniProfileUrn=urn%3Ali%3Afs_miniProfile%3AACoAAAhBYfwBw6mIdUtulYou6-910HA-n6Da1eU#,,Software Engineer II at Microsoft,"San Francisco, California, United States",Anshuman D,Vyas,Anshuman D Vyas,966,3rd,ACoAAAhBYfwBw6mIdUtulYou6-910HA-n6Da1eU,138502652,"https://www.linkedin.com/sales/people/ACoAAAhBYfwBw6mIdUtulYou6-910HA-n6Da1eU,name",500,https://www.linkedin.com/search/results/people/?facetConnectionOf=%5B%22ACoAAAhBYfwBw6mIdUtulYou6-910HA-n6Da1eU%22%5D&facetNetwork=%5B%22F%22%2C%22S%22%5D&origin=MEMBER_PROFILE_CANNED_SEARCH,https://www.linkedin.com/search/results/people/?facetNetwork=%5B%22F%22%5D&facetConnectionOf=%5B%22ACoAAAhBYfwBw6mIdUtulYou6-910HA-n6Da1eU%22%5D&origin=MEMBER_PROFILE_CANNED_SEARCH&RESULT_TYPE=PEOPLE,Microsoft,https://www.linkedin.com/company/microsoft/,Software Engineer,"San Francisco, California",Jun 2017 ï¿½ï¿½ï¿½ P,Ooyala,https://www.linkedin.com/company/ooyala/,Software Engineer,"Santa Clara, California",Nov 2015 ï¿½ï¿½ï¿½ Ma,The Johns Hopkins University,https://www.linkedin.com/school/18560/?legacySchoolId=18560,Specialization,Data Science,2014 ï¿½ï¿½ï¿,The George Washington University,https://www.linkedin.com/school/18068/?legacySchoolId=18068,Master of Science (M.S.),Computer Science,2011 ï¿½ï¿½ï¿,"Scala, C#, Java, Data Mining, Machine Learning, Mathematics, Artificial Intelligence, Debugging, Computer Science, Distributed Systems, Algorithms, Object Oriented Design, Data Science, Microsoft Azure, R, .NET, JSON, REST, Core Java, Python, Microsoft SQL Server, MySQL, JavaScript, Git, JIRA, React.js, Azure Cosmos DB, Redux.js, Azure Functions, Active Directory, Azure Key Vault, GraphQL, Apollo GraphQL, Problem Solving, Natural Language Processing, Cassandra, Play, Regression Models, Prediction, Tokenization, Linear Regression, Exploratory Data Analysis, Play Framework, RStudio, ORM, Load Balancing, Microservices, Service Oriented Architecture Design, Serverless",Scala,5,C#,8,Java,22,Data Mining,16,Machine Learning,6,Mathematics,4,https://www.linkedin.com/in/anshuman-d-vyas-bb84733a?miniProfileUrn=urn%3Ali%3Afs_miniProfile%3AACoAAAhBYfwBw6mIdUtulYou6-910HA-n6Da1eU,,2021-05-03T19:46:32.983Z,,https://media-exp1.licdn.com/dms/image/C5603AQEWfYOvfYFcWw/profile-displayphoto-shrink_800_800/0/1602723269165?e=1625702400&v=beta&t=9UnZgXdBxpNjLNY7JUp27K8G2NiKYGpAXrv-m1fsSmQ,,"ýýý	Built Ooyalaýýýs discovery video playlist RESTful API service from the ground up using Scala, Play Framework, and Cassandra. Wrote the design document, formalized the use cases and class diagrams, wrote unit tests, deployed to staging & production on AWS, configured production routes, added logging, setup Neustar monitoring and ensured the SLA was met.
ýýý	Built the Trending API for Ooyalaýýýs next generation recommender system using Scala, Play Framework. This API is used by a client application(consumer-facing UI) to show a carousel with content ranked based on the acceleration in views in the time period specified.
ýýý	Built Ooyalaýýýs Analytics Reporting service from the ground up using Scala, Play Framework, Ebean ORM and MySql. Deployed to staging and production environments on AWS through Chef Delivery. This service provides APIýýýs which are used by the frontend to perform different types of CRUD operations on Reports, Templates and Processed Reports.
ýýý	Built Ooyalaýýýs Live Analytics API from ground up. This service provides APIï¿½ï¿½ï¿½s for getting the number of concurrent users watching a providerï¿½ï¿½ï¿½s videos at that moment or in a requested time range, with a 1 min granularity. Several filters and metrics were supported.
ï¿½ï¿½ï¿½	Added enhancements and fixed bugs in multiple components of the analytics pipeline, starting from ingesting data to creating datacubes and finally querying them.
ï¿½ï¿½ï¿½	Added Datadog monitors for multiple services to track their performance.
ï¿½ï¿½ï¿½	Built an internal tool for monitoring the data cube accuracy and regenerating the data cubes if needed. LDAP Authentication and Authorization was also added.
ï¿½ï¿½ï¿½	Served as 24/7 Oncall periodically and addressed system outages, support incidents (via Pager Duty), and bugs.
  
      
     ",,,!4.".-29,,,,
https://www.linkedin.com/in/ansonh/?miniProfileUrn=urn%3Ali%3Afs_miniProfile%3AACoAAAT1BXgBxOfXI1KAXshPRrQKFstOqFRwFqw,,Software Development Lead,Greater Seattle Area,Anson,Ho,Anson Ho,473,3rd,ACoAAAT1BXgBxOfXI1KAXshPRrQKFstOqFRwFqw,83166584,"https://www.linkedin.com/sales/people/ACoAAAT1BXgBxOfXI1KAXshPRrQKFstOqFRwFqw,name",472,https://www.linkedin.com/search/results/people/?facetConnectionOf=%5B%22ACoAAAT1BXgBxOfXI1KAXshPRrQKFstOqFRwFqw%22%5D&facetNetwork=%5B%22F%22%2C%22S%22%5D&origin=MEMBER_PROFILE_CANNED_SEARCH,https://www.linkedin.com/search/results/people/?facetNetwork=%5B%22F%22%5D&facetConnectionOf=%5B%22ACoAAAT1BXgBxOfXI1KAXshPRrQKFstOqFRwFqw%22%5D&origin=MEMBER_PROFILE_CANNED_SEARCH&RESULT_TYPE=PEOPLE,Facebook,https://www.linkedin.com/company/facebook/,Software Engineer,Greater Seattle Area,Apr 2019 ï¿½ï¿½ï¿½ P,InsightFinder Inc.,https://www.linkedin.com/company/insightfinder-inc./,Chief Architect,,Jun 2018 ï¿½ï¿½ï¿½ Se,North Carolina State University,https://www.linkedin.com/search/results/all/?keywords=North%20Carolina%20State%20University,PhD Student,Computer Science,2011 ï¿½ï¿½ï¿,National Tsing Hua University,https://www.linkedin.com/school/17472/?legacySchoolId=17472,Master of Science (M.S.),Information Systems and Applications,2006 ï¿½ï¿½ï¿,"Software Development, Android, Python, Android Development, Distributed Systems, Web Development, Programming, iOS development, Web Applications, Android Framework, Scrum Master, Agile Methodologies, Project Management, Continuous Integration, Payments, Mobile Payments, Financial Risk, Java, C++, JavaScript, C, Git, Objective-C, XML, C/C++, Amazon Web Services (AWS), MongoDB, React, InfluxDB, iPhone development, Software Development Methodologies, Cassandra, Unsupervised Learning, Anomaly Detection, Large-scale Data Analysis, Smartphone Security, NativeClient, Web application develop",Software Development,25,Android,22,Python,19,Android Development,9,Distributed Systems,8,Web Development,6,https://www.linkedin.com/in/ansonh?miniProfileUrn=urn%3Ali%3Afs_miniProfile%3AACoAAAT1BXgBxOfXI1KAXshPRrQKFstOqFRwFqw,,2021-05-03T19:46:58.814Z,"Anson is an experienced tech lead and engineering manager. He has wide interests in different domain such as security & privacy, machine learning, mobile, and large scale storage system.  He also has strong experience on improving software development environments and iteration cycles. 

I've been focused on product architecture and team/product/project management in the past 3 years. Please do NOT contact me for mobile developer positions.

",https://media-exp1.licdn.com/dms/image/C4D03AQEPndsMkHLFHQ/profile-displayphoto-shrink_800_800/0/1517050810717?e=1625702400&v=beta&t=EX2VJvzIVd551xmo5In6yikHxN0VWuOjcm87bjeUrOE,"Lead, Facebook Pay Security","Manage the team to
- Improve core data processing speed by 100 times, and overall speed by 6 times
- Improve Cassandra stability and speed by revamping datastore schema (timeouts vs sub-10 seconds access time)
- Improve stability of RabbitMQ consumers
- Manage issues, map customer needs into features, and provide proper solutions and designs
- Introduce CICD concept, streamline release processes
  
      
          ï¿½ï¿½ï¿½
        
          se",,,,,,,
https://www.linkedin.com/in/anthonycheng12/?miniProfileUrn=urn%3Ali%3Afs_miniProfile%3AACoAABFyWW8BUJoKvmNishDuMkARPv9mmnls5yU,,Software Development Engineer at Amazon,"New York, New York, United States",Anthony,C.,Anthony C.,486,3rd,ACoAABFyWW8BUJoKvmNishDuMkARPv9mmnls5yU,292706671,"https://www.linkedin.com/sales/people/ACoAABFyWW8BUJoKvmNishDuMkARPv9mmnls5yU,name",488,https://www.linkedin.com/search/results/people/?facetConnectionOf=%5B%22ACoAABFyWW8BUJoKvmNishDuMkARPv9mmnls5yU%22%5D&facetNetwork=%5B%22F%22%2C%22S%22%5D&origin=MEMBER_PROFILE_CANNED_SEARCH,https://www.linkedin.com/search/results/people/?facetNetwork=%5B%22F%22%5D&facetConnectionOf=%5B%22ACoAABFyWW8BUJoKvmNishDuMkARPv9mmnls5yU%22%5D&origin=MEMBER_PROFILE_CANNED_SEARCH&RESULT_TYPE=PEOPLE,Amazon,https://www.linkedin.com/company/amazon/,Software Engineer,"Seattle, Washington",Dec 2019 ï¿½ï¿½ï¿½ P,Comcast,https://www.linkedin.com/company/comcast/,API Software Engineer Co-Op,"Philadelphia, Pennsylvania",Jan 2019 ï¿½ï¿½ï¿½ Ju,New York University,https://www.linkedin.com/school/18993/?legacySchoolId=18993,Bachelor of Arts (B.A.),Computer Science,2016 ï¿½ï¿½ï¿,New York University - Polytechnic School of Engineering,https://www.linkedin.com/school/19003/?legacySchoolId=19003,Bachelor of Science (B.S.),Business and Technology Management,2015 ï¿½ï¿½ï¿,"Java, Python, Vue.js, Research, Microsoft Excel, Microsoft Word, HTML, Cascading Style Sheets (CSS), Bootstrap, jQuery, JavaScript, SQL, Public Speaking, Leadership, Customer Service",Java,6,Python,5,Vue.js,1,Research,3,Microsoft Excel,3,Microsoft Word,3,https://www.linkedin.com/in/anthonycheng12?miniProfileUrn=urn%3Ali%3Afs_miniProfile%3AACoAABFyWW8BUJoKvmNishDuMkARPv9mmnls5yU,,2021-05-03T19:47:23.628Z,"Software Development Engineer at Amazon. Previously a student at New York University with a degree focused in Computer Science with a minor in Web Programming and Applications. Skilled with Java, JavaScript, Node, Vue.js, Express, HTML and CSS.

Check out my work on github: https://github.com/anthonycheng12
Personal website: https://anthonycheng12.github.io/mywebsite",https://media-exp1.licdn.com/dms/image/C4D03AQFaSQz2doYWnQ/profile-displayphoto-shrink_800_800/0/1552017283052?e=1625702400&v=beta&t=LMrgx3nXdvRVU63OsNMgvqn7dVwUicwtVJOArd5C7ic,,,,,,https://github.com/anthonycheng12,,,
https://www.linkedin.com/in/anton-nikolenko-82382061/?miniProfileUrn=urn%3Ali%3Afs_miniProfile%3AACoAAA0dFpsBHIrUrJHxwWuqQekLclK-btZrev4#,,Software Engineer II at Microsoft,Greater Seattle Area,Anton,Nikolenko,Anton Nikolenko,2102,3rd,ACoAAA0dFpsBHIrUrJHxwWuqQekLclK-btZrev4,220010139,"https://www.linkedin.com/sales/people/ACoAAA0dFpsBHIrUrJHxwWuqQekLclK-btZrev4,name",500,https://www.linkedin.com/search/results/people/?facetConnectionOf=%5B%22ACoAAA0dFpsBHIrUrJHxwWuqQekLclK-btZrev4%22%5D&facetNetwork=%5B%22F%22%2C%22S%22%5D&origin=MEMBER_PROFILE_CANNED_SEARCH,https://www.linkedin.com/search/results/people/?facetNetwork=%5B%22F%22%5D&facetConnectionOf=%5B%22ACoAAA0dFpsBHIrUrJHxwWuqQekLclK-btZrev4%22%5D&origin=MEMBER_PROFILE_CANNED_SEARCH&RESULT_TYPE=PEOPLE,Microsoft,https://www.linkedin.com/company/microsoft/,Software Engineer,"Redmond, WA",Jun 2018 ï¿½ï¿½ï¿½ P,Microsoft,https://www.linkedin.com/company/microsoft/,Software Engineer,"Redmond, Washington",Feb 2017 ï¿½ï¿½ï¿½ Ju,Highline College,https://www.linkedin.com/school/20210/?legacySchoolId=20210,,Second Language Learning,2014 ï¿½ï¿½ï¿,Renton Technical College,https://www.linkedin.com/school/32523/?legacySchoolId=32523,,Second Language Learning,2013 ï¿½ï¿½ï¿,"Node.js, JavaScript, MongoDB, Object Oriented Design, HTML, Github, CSS, Java, SQL, C#, Microsoft Visual Studio, Spring MVC, Objective-C, C++, Windows, Mac OS, Ubuntu, MySQL, XML, Microsoft Word, Microsoft Excel, Eclipse, Xcode, Hibernate, Subversion, Socket.io, Strongly self-motivated, RESTful architecture",Node.js,7,JavaScript,10,MongoDB,5,Object Oriented Design,2,HTML,8,Github,4,https://www.linkedin.com/in/anton-nikolenko-82382061?miniProfileUrn=urn%3Ali%3Afs_miniProfile%3AACoAAA0dFpsBHIrUrJHxwWuqQekLclK-btZrev4,,2021-05-03T19:47:45.678Z,"More than 5 years of experience developing web applications, distributed databases and web services.
Strongly deadline-driven, self-motivated and excellent problem-solving skills.
Together with my background as a back-end developer, I feel I bring a unique perspective and an added a bonus to front-end development. By combining smart user interface design with professional content and clean, organized code, my skills will be an asset to any project or team. I am passionate about solving challenging  problems, meticulous about my work and constantly striving to perfect my craft.",https://media-exp1.licdn.com/dms/image/C5603AQEtfA6cKCVbYQ/profile-displayphoto-shrink_800_800/0/1517582233187?e=1625702400&v=beta&t=wbj0FG86JlJf7WXneIHUTaM06hUnm68u2-K0RTZusqg,,,,,..-20,http://www.antonnikolenko.com,,,
https://www.linkedin.com/in/anup-rao-38393117/?miniProfileUrn=urn%3Ali%3Afs_miniProfile%3AACoAAAOE19MBKzLESpY_5Ti__PIQQUjAwo4Ge4M,,Software Development Engineer 2 at Microsoft,Atlanta Metropolitan Area,Anup,Rao,Anup Rao,656,3rd,ACoAAAOE19MBKzLESpY_5Ti__PIQQUjAwo4Ge4M,59037651,"https://www.linkedin.com/sales/people/ACoAAAOE19MBKzLESpY_5Ti__PIQQUjAwo4Ge4M,name",500,https://www.linkedin.com/search/results/people/?facetConnectionOf=%5B%22ACoAAAOE19MBKzLESpY_5Ti__PIQQUjAwo4Ge4M%22%5D&facetNetwork=%5B%22F%22%2C%22S%22%5D&origin=MEMBER_PROFILE_CANNED_SEARCH,https://www.linkedin.com/search/results/people/?facetNetwork=%5B%22F%22%5D&facetConnectionOf=%5B%22ACoAAAOE19MBKzLESpY_5Ti__PIQQUjAwo4Ge4M%22%5D&origin=MEMBER_PROFILE_CANNED_SEARCH&RESULT_TYPE=PEOPLE,Microsoft,https://www.linkedin.com/company/microsoft/,Software Engineer,Bellevue,Mar 2020 ï¿½ï¿½ï¿½ P,VMware,https://www.linkedin.com/company/vmware/,Member Of Technical Staff,Greater Atlanta Area,Jan 2018 ï¿½ï¿½ï¿½ Ma,Rochester Institute of Technology,https://www.linkedin.com/school/19008/?legacySchoolId=19008,MS,Computer Science,2008 ï¿½ï¿½ï¿,Sardar Patel University,https://www.linkedin.com/school/13610/?legacySchoolId=13610,Bachelor of Engineering,Computer Engineering,2003 ï¿½ï¿½ï¿,"C#, Visual Studio, ASP.NET, Web Services, Web Applications, Software Development, Data Structures, Shell Scripting, OOP, XML, JavaScript, Microsoft SQL Server, Databases, .NET, VB.NET, jQuery, SQL, LINQ, AJAX, WPF, SQL Server, Java, C++, PL/SQL, WCF, ADO.NET, Linux, ASP, Matlab, ASP.NET AJAX, C, SOAP, HTML, IIS, CSS, MVC, Silverlight",C#,29,Visual Studio,23,ASP.NET,17,Web Services,11,Web Applications,9,Software Development,6,https://www.linkedin.com/in/anup-rao-38393117?miniProfileUrn=urn%3Ali%3Afs_miniProfile%3AACoAAAOE19MBKzLESpY_5Ti__PIQQUjAwo4Ge4M,,2021-05-03T19:48:11.137Z,"ýýý     7 years of experience in Design, Development and maintenance of  highly available and scalable Applications.
ýýý     Extensive Experience in .NET Applications (WPF / MVC Apps) and Web Services in VS 2012 IDE using C# 4.5, ASP.Net.
ýýý     Strong back-end experience of Web Services (WCF / Rest-full), Entity Framework, Repository pattern, ADO.Net, 
ýýý     Strong Front-End experience in Web that includes HTML, CSS AJAX, Jquery and JavaScript.
ýýý     Strong knowledge of Design patterns (MVC , MVVM, Abstract Factory, Strategy, Singleton, Adapter, more) and Generics.
ýýý     Experience in multi-threading applications and .Net Framework Task parallel Library.
ýýý     Experience in database programming (Data Modeling , Performance Tuning, implementing stored procedures in T-SQL, SQL Server).
ýýý     Strong knowledge of Data Structure and Algorithms and Good Problem solving skills.
ýýý     Microsoft Certified Professional in .Net application development and Foundation

Languages: C# ,C, C++, JAVA, VB.Net
Environments: Window, Mac OS
Technologies:  Entity Framework, Angular.Js, LINQ, AJAX, Web Services, Web API
Database: SQL Server 2012, Microsoft Access, MySQL
Software Tools: Eclipse, Microsoft Visual Studio, TFS, Power Shell",https://media-exp1.licdn.com/dms/image/C4D03AQFctXpUI52xIg/profile-displayphoto-shrink_800_800/0/1516767381314?e=1625702400&v=beta&t=uKX2ZoRmtjspuGvB82JWfCC-vCtl6R129uWGh2bhNw8,,,,,..-15,http://www.anuprao85.com/,,,
https://www.linkedin.com/in/aperugu/?miniProfileUrn=urn%3Ali%3Afs_miniProfile%3AACoAAAgzMPwBtj4fC7Mi6SuBnmtn8Je-98L2Ppk,,Software Engineer at Microsoft,"San Jose, California, United States",Amulya,PERUGUPALLI,Amulya PERUGUPALLI,304,3rd,ACoAAAgzMPwBtj4fC7Mi6SuBnmtn8Je-98L2Ppk,137572604,"https://www.linkedin.com/sales/people/ACoAAAgzMPwBtj4fC7Mi6SuBnmtn8Je-98L2Ppk,name",300,https://www.linkedin.com/search/results/people/?facetConnectionOf=%5B%22ACoAAAgzMPwBtj4fC7Mi6SuBnmtn8Je-98L2Ppk%22%5D&facetNetwork=%5B%22F%22%2C%22S%22%5D&origin=MEMBER_PROFILE_CANNED_SEARCH,https://www.linkedin.com/search/results/people/?facetNetwork=%5B%22F%22%5D&facetConnectionOf=%5B%22ACoAAAgzMPwBtj4fC7Mi6SuBnmtn8Je-98L2Ppk%22%5D&origin=MEMBER_PROFILE_CANNED_SEARCH&RESULT_TYPE=PEOPLE,Microsoft,https://www.linkedin.com/company/microsoft/,Software Engineer,San Francisco Bay Area,May 2017 ï¿½ï¿½ï¿½ P,Microsoft,https://www.linkedin.com/company/microsoft/,Software Engineer,"Redmond, Washington",Nov 2016 ï¿½ï¿½ï¿½ Ma,North Carolina State University,https://www.linkedin.com/search/results/all/?keywords=North%20Carolina%20State%20University,Master of Science (MS),Computer Science,2013 ï¿½ï¿½ï¿,Jawaharlal Nehru Technological University,https://www.linkedin.com/school/13520/?legacySchoolId=13520,Bachelor of Technology (BTech),Computer Science,2009 ï¿½ï¿½ï¿,"Java, Eclipse, PHP, Android Development, TCP/IP, SAN, NAS, Software Engineering, Scripting, C++, Ruby on Rails, SQL, Operating Systems, JDBC, JSP, HTML, Linux, Unix, Python, Perl, Networking, Deduplication, DBMS, Socket Programming, UDP, Enterprise Storage, Amazon EC2, Fibre Channel, SCSI, Storage Architecture, Distributed File Systems, P2P, XINU",Java,7,Eclipse,4,PHP,4,Android Development,1,TCP/IP,1,SAN,0,https://www.linkedin.com/in/aperugu?miniProfileUrn=urn%3Ali%3Afs_miniProfile%3AACoAAAgzMPwBtj4fC7Mi6SuBnmtn8Je-98L2Ppk,,2021-05-03T19:48:30.657Z,,https://media-exp1.licdn.com/dms/image/C5603AQFVYDtlw8sF3Q/profile-displayphoto-shrink_800_800/0/1516837429545?e=1625702400&v=beta&t=sldXEKj4YulxvK0CqHxq89EHAmQeJrfffK2633nMG6E,"Cloud software developer. Working on developing Azure Application Gateway, a layer 7 load balancer.",,,,,,,,
https://www.linkedin.com/in/apoorva-arunkumar-1a2b28b7/?miniProfileUrn=urn%3Ali%3Afs_miniProfile%3AACoAABjnzQoBMZX1sT3xgfIuO6UedyGzn3FKMh0,,Software Engineer at Facebook,"Menlo Park, California, United States",Apoorva,Arunkumar,Apoorva Arunkumar,283,3rd,ACoAABjnzQoBMZX1sT3xgfIuO6UedyGzn3FKMh0,417844490,"https://www.linkedin.com/sales/people/ACoAABjnzQoBMZX1sT3xgfIuO6UedyGzn3FKMh0,name",284,https://www.linkedin.com/search/results/people/?facetConnectionOf=%5B%22ACoAABjnzQoBMZX1sT3xgfIuO6UedyGzn3FKMh0%22%5D&facetNetwork=%5B%22F%22%2C%22S%22%5D&origin=MEMBER_PROFILE_CANNED_SEARCH,https://www.linkedin.com/search/results/people/?facetNetwork=%5B%22F%22%5D&facetConnectionOf=%5B%22ACoAABjnzQoBMZX1sT3xgfIuO6UedyGzn3FKMh0%22%5D&origin=MEMBER_PROFILE_CANNED_SEARCH&RESULT_TYPE=PEOPLE,Facebook,https://www.linkedin.com/company/facebook/,Software Engineer,"Menlo Park, California",Aug 2018 ï¿½ï¿½ï¿½ P,University of Virginia,https://www.linkedin.com/company/university-of-virginia/,Teaching Assistant,,Aug 2015 ï¿½ï¿½ï¿½ Ma,University of Virginia,https://www.linkedin.com/school/19604/?legacySchoolId=19604,Bachelor's Degree,Computer Science,2014 ï¿½ï¿½ï¿,Loudoun County Academy of Science,https://www.linkedin.com/search/results/all/?keywords=Loudoun%20County%20Academy%20of%20Science,High School,,2010 ï¿½ï¿½ï¿,"Java, Android Development, Data Analysis, Research, C++, C#, Ruby on Rails, HTML, Python, CSS, JavaScript, Linux, Microsoft Office, Mathematica, MathCAD, League of Legends, Pouring bowls of cereal, Pokï¿½ï¿½mon Training",Java,7,Android Development,3,Data Analysis,3,Research,3,C++,4,C#,1,https://www.linkedin.com/in/apoorva-arunkumar-1a2b28b7?miniProfileUrn=urn%3Ali%3Afs_miniProfile%3AACoAABjnzQoBMZX1sT3xgfIuO6UedyGzn3FKMh0,,2021-05-03T19:48:51.545Z,,https://media-exp1.licdn.com/dms/image/C5603AQGTCnHbkMQEXQ/profile-displayphoto-shrink_800_800/0/1516856276521?e=1625702400&v=beta&t=fI-XYjyeTeJKwINQNuZ0yRm4jFUhWvV1A9_Vn0fTUmA,Full stack development on Core Growth Team,CS4720 (Mobile App Development) and CS2110 (Intermediate Software Development),,,,,,,
https://www.linkedin.com/in/apoorv-mittal/?miniProfileUrn=urn%3Ali%3Afs_miniProfile%3AACoAAB8egSgBdv17PhVsmO8iwCBSuHIDP_mmQn0,,.,"Austin, Texas Metropolitan Area",Apoorv,M.,Apoorv M.,715,3rd,ACoAAB8egSgBdv17PhVsmO8iwCBSuHIDP_mmQn0,522092840,"https://www.linkedin.com/sales/people/ACoAAB8egSgBdv17PhVsmO8iwCBSuHIDP_mmQn0,name",500,https://www.linkedin.com/search/results/people/?facetConnectionOf=%5B%22ACoAAB8egSgBdv17PhVsmO8iwCBSuHIDP_mmQn0%22%5D&facetNetwork=%5B%22F%22%2C%22S%22%5D&origin=MEMBER_PROFILE_CANNED_SEARCH,https://www.linkedin.com/search/results/people/?facetNetwork=%5B%22F%22%5D&facetConnectionOf=%5B%22ACoAAB8egSgBdv17PhVsmO8iwCBSuHIDP_mmQn0%22%5D&origin=MEMBER_PROFILE_CANNED_SEARCH&RESULT_TYPE=PEOPLE,Google,https://www.linkedin.com/company/google/,Software Engineer,"Austin, Texas, United States",Feb 2020 ï¿½ï¿½ï¿½ P,"DrFirst, Inc.",https://www.linkedin.com/company/drfirst/,Software Engineer Intern,,Jun 2019 ï¿½ï¿½ï¿½ No,University of Maryland College Park,https://www.linkedin.com/school/18570/?legacySchoolId=18570,Bachelorï¿½ï¿½ï¿½s ,Computer Science,2016 ï¿½ï¿½ï¿,Free Code Camp,https://www.linkedin.com/school/166029/?legacySchoolId=166029,Full Stack Web Development Certification,Computer Software Engineering,2015 ï¿½ï¿½ï¿,"Web Development, Java, JavaScript, React.js, Drupal, Cascading Style Sheets (CSS), jQuery, Bootstrap, C, Javascript, Linux, SQL, Matlab, Python, Wireshark",Web Development,1,Java,2,JavaScript,0,React.js,0,Drupal,0,Cascading Style Sheets (CSS),0,https://www.linkedin.com/in/apoorv-mittal?miniProfileUrn=urn%3Ali%3Afs_miniProfile%3AACoAAB8egSgBdv17PhVsmO8iwCBSuHIDP_mmQn0,,2021-05-03T19:49:19.187Z,,,,"- Designed and developed RESTful apis in Spring Boot Integration server for DrFirstï¿½ï¿½ï¿½s e-prescribing mobile app to support a new third-party identity proofing system. Helped come up with the changes required in two other applications for this integration
- Communicated with product owners and third-party companies about requirements for any new feature or implementation change, ensuring NIST standards and legal guidelines 
- Fixing production issues related to Single Sign-On users unable to login after using the old identity proofing method. Worked with Data base Administrators, and Support Staff to identify, solve and verify the problems
- Helped Quality Assurance Engineers understand new SureScript standard resulting in robust testing
- Applied Best Practices of Software Design to elevate code quality and system design. Feature Driven Development, Pair Programming and Extreme Programming.  
- Collaborated and participated in daily Scrum/Agile meetings, code reviews, and sprint planning
  
      
    ýýý
        
          see more",,,,github.com/Apoorv-Mittal,,,
